,Document,DominantTopic,ContributionPercent,TopicDesc,Comment Body,Cleaned_Comment
890,890,2,87.24,"phone, year, fix, pro, people, use, like, samson, make, get, buy, one, apple, think, even, goose, look, come, still, see","Wow. An ultrawide camera that's been on other phones for years.

Silicone carbon batteries are just becoming the norm even though phones have had them for a year or so now? Honor used it last Jan already. All phones released, and upcoming by every other brand aside from Samsung and google are using silicone carbon.

I don't know enough about stocks and politics, so I can't properly comment.

I don't have a vendetta, I'm a loyalist since s6 edge.

Just frustrating to see how trash their updates have become. I'm invested in the ecosystem, and used to the OS. I use heaps of Samsung exclusive features others don't (like the Spen, I use it daily. And even that is getting a downgrade.  Great)",ultrawide camera phone year silicone carbon battery become norm even though phone year honor use last jan already phone release come every brand aside samson goose use silicone carbon I know enough stock politic I properly comment I vendetta I loyalist since edge frustration see trash update become I invest ecosystem use os I use heap samson exclusive feature like see I use daily even get downgrade great
421,421,1,86.28,"well, camera, ultra, go, would, get, phone, like, samson, new, use, still, launch, time, screen, battery, really, also, thing, take","I am buying a FLAGSHIP or a so called ""ULTRA""


I'm not getting a copy and paste. 


Also as far as your statement about other brands not having more or better features. Let me correct you.. Let's take a One plus 13 as an example. 


6000ma battery
120w fast charging 
4500nits
2k screen
8 gen elite 
IP69 water proof


or let's take the vivo x200 pro




6000ma battery 
Log video (raw) 
4500 nits
90w fast charging


Or let's take the Xiaomi 15 ultra 


1 inch camera sensor 
5400ma battery 
10bit LOG raw video 
90w fast charging 


Your telling me the s25 ultra has better specs than these? 😂 


If you are, you are seriously deluded and are just justifying whatever Samsung gives.. Samsung could take away all the cameras and put in a 10mp camera and you will still try your best to defend them


Also when a phone claims it's ULTRA or FLAGSHIP, I EXPECT ultra and flagship specs or else I would get a mid range phone 


Samsung has used the SAME camera sensor since the s21 ultra  Let this sink in your head or are you in denial 


""it's m13 plus, not m13""  Doesn't matter how you slice it or go around the bushes with it.. IT IS STILL THE OLDER M13. It isn't the NEWER M14 panel. Samsung are giving you older specs not new ones 


Also the only thing you mentioned is the new snap dragon 8 elite.. Guess what? EVERY FLAGSHIP from 2025 Is ALSO getting the 8 elite chip combined with all other flagship features I listed.. The s25 ultra has the 8 elite but has nothing else or old specs 


vivo, xiaomi, Oppo are all getting the new 8 gen elite . Your whole statement was based on the 8 gen elite. You probably thought the s25 ultra is the only one getting it 😂


Sorry to tell you but so is every other flagship ",I buy flagship call ultra I get copy paste also far statement band well feature let I correct let take one plus example battery w fast charge k screen gen elite water proof let take vive x pro battery log video raw w fast charge let take xiaomi ultra inch camera senior battery bit log raw video w fast charge tell I ultra well speck seriously delude justify whatever samson give samson could take away camera put camera still try well defend also phone claim ultra flagship I expect ultra flagship speck else I would get mid range phone samson use camera senior since ultra let sink head denial plus matter slice go around bush still old new panel samson give old speck new one also thing mention new snap dragon elite guess every flagship also get elite chip combine flagship feature I list ultra elite nothing else old speck vive xiaomi oo get new gen elite whole statement base gen elite probably think ultra one get sorry tell every flagship
877,877,1,85.11,"well, camera, ultra, go, would, get, phone, like, samson, new, use, still, launch, time, screen, battery, really, also, thing, take","I think we have a different approach. Yours is the end result, and mine is the exact steps that result in a certain outcome. 

For example, 

Better battery life can be achieved through throttling, limiting services, worse hardware, etc. 

Better picture/video quality can be achieved through software optimisations, fake ""AI"", etc. 

You would get better battery life and photos, but would you be happy with them being achieved through the above described methods? 

For me, I know exactly what the outcome would be from a silicon-carbon battery: Bigger battery, better battery life. 

A better camera hardware would result in more potential, which would either be unlocked immediately, or eventually, through a software update.",I think different approach end result mine exact step result certain outcome example well battery life achieve throttle limit service bad hardware etc well picturevideo quality achieve software optimisation face ai etc would get well battery life photo would happy achieve describe method I I know exactly outcome would siliconcarbon battery big battery well battery life well camera hardware would result potential would either unlocked immediately eventually software update
970,970,2,84.63,"phone, year, fix, pro, people, use, like, samson, make, get, buy, one, apple, think, even, goose, look, come, still, see","> Silicone carbon batteries are just becoming the norm even though phones have had them for a year or so now? Honor used it last Jan already. All phones released, and upcoming by every other brand aside from Samsung and google are using silicone carbon.




Tho it does feel like the ""exclusivity deal"" Honor had with their silicon carbon battery manufacturer only ended relatively recently; the second ever brand to sell phones with silicon carbon batteries was Vivo in April 2024 (Vivo X Fold3 series & iQOO Z9 series)",silicone carbon battery become norm even though phone year honor use last jan already phone release come every brand aside samson goose use silicone carbon feel like exclusively deal honor silicon carbon battery manufacturer end relatively recently second ever brand sell phone silicon carbon battery vive april vive x fold series iso z series
209,209,2,84.43,"phone, year, fix, pro, people, use, like, samson, make, get, buy, one, apple, think, even, goose, look, come, still, see","I think apple spoiled people on its early day about how much innovation is needed in a phone every year. It's a goddamn phone, you should be able to use one for years after buying it. The small spec bumps add up considerably if you change every 4 years. I basically went iphone 6 > iphone Xr > S24U and it felt amazing every time while a horde of people clown on phone makers because the phone doesn't have enough innovations invented in 1 year, save for software updates and better specs every year.",I think apple spoil people early day much innovation need phone every year goddamn phone able use one year buy small speck bump add considerably change every year I basically go phone phone feel amazing every time horde people clown phone maker phone enough innovation invent year save software update well speck every year
1139,1139,1,83.39,"well, camera, ultra, go, would, get, phone, like, samson, new, use, still, launch, time, screen, battery, really, also, thing, take","I use a third party launcher on pixels and I find it to be no problem at all. Some people must be really sensitive to the animations or something because I never have any (noticeable) bugs on third party launchers with pixels or with Samsung for that matter. Outside of Android 10.

Maybe it's b. I turn animations down to .5 anyways but to me I don't notice it at

I'm not saying they don't exist, I know newer versions of Android do restrict the launcher's ability to have access to certain APIs. But to me Nova launcher is a great experience on a pixel.  Way better than the stock launcher. And I would say the same thing about Samsung. 

Although I've heard the exact opposite thing you did in fact I explicitly read an article that explained why Nova launcher works better on pixels than it does on Samsung. 

But in both cases, whatever bugs and limitations exist, I find third party launchers like Nova to be way better than one UI or the pixel home screen.

But I do know all of these third party launchers are organizing to try to get more access to animations and other things that they cannot control. So I do think Android could be more hospitable to launchers I just know from my user experience then they are way superior to the pixel launcher or one UI. 

Like the fact that you can't customize launchers on either of the stock launchers right there is reason enough for me to switch to Nova. 

Double tapping for my remote control or swiping up and down on icons for shortcuts should be available on every these devices.",I use third party launch pipe I find problem people must really sensitive animation something I never noticeable bag third party launch pipe samson matter outside andros maybe b I turn animation anyway I I notice I say exist I know new version andros restrict launch ability access certain axis I nova launch great experience fix way well stock launch I would say thing samson although I hear exact opposite thing fact I explicitly read article explain nova launch work well pipe samson case whatever bag limitation exist I find third party launch like nova way well one I fix home screen I know third party launch organize try get access animation thing control I think andros could hospitable launch I know user experience way superior fix launch one I like fact customize launch either stock launch right reason enough I switch nova double tap remote control wipe icon shortcut available every device
611,611,2,83.11,"phone, year, fix, pro, people, use, like, samson, make, get, buy, one, apple, think, even, goose, look, come, still, see","Apple used to be the company that made products people didn't think they needed. No one thought they needed an ipod, ipad, wireless airpods, a touchscreen iphone etc. Yet they brought them all to the market.

Stop making excuses for a complacent company. Being complacent is the exact reason Nokia and Microsoft had their lunch eaten by Apple and Google.",apple use company make product people think need one think need upon pad tireless airport touchscreen phone etc yet bring market stop make excuse complacent company complacent exact reason nikita microsoft lunch eat apple goose
542,542,2,82.96,"phone, year, fix, pro, people, use, like, samson, make, get, buy, one, apple, think, even, goose, look, come, still, see","I can agree with you on the PC gaming. I'm cool with hitting at least 90 fps. The thing with 60hz on the non pro iPhones still is crazy. Especially when you look at it from another perspective. Motorola puts 120hz on the Motorola Edge phone. It's about a $500 phone. On the 2023 Motorola Edge model they put it up to 144hz. Yes, 144hz is not needed on a phone. Point being, these are $500 dollar phones. In the Android world 120hz is pretty standard now. About every phone has it. Or some have at minimum 90hz. We all know Apple gatekeeps but at what point does it become ridiculous especially with the price of an iPhone.",I agree pp gaze I cool hit least fas thing non pro phone still crazy especially look another perspective motorola put motorola edge phone phone motorola edge model put yes need phone point dollar phone andros world pretty standard every phone minimum know apple gatekep point become ridiculous especially price phone
1038,1038,2,82.9,"phone, year, fix, pro, people, use, like, samson, make, get, buy, one, apple, think, even, goose, look, come, still, see","Of course they're waiting for apple. They didn't remove the headphone jack or the charger in the box until Apple did it. 

People aren't willing to pay for extras unless they see apple do it because apple is thought of as an innovative tech company and their contributions as useful by default, even if they aren't useful and even if they weren't the first one to introduce it. But that doesn't change the expectation.",course wait apple remove headphone jack charge box apple people willing pay extra unless see apple apple think innovative teach company contribution useful default even useful even first one introduce change expectation
798,798,1,82.66,"well, camera, ultra, go, would, get, phone, like, samson, new, use, still, launch, time, screen, battery, really, also, thing, take","> Still starting with 128GB of storage. 

only on the S25 base, both the S25+ and S25 Ultra start at 256GB of storage.

S25 base does offer a 256GB and 512GB option.

So you can get the S25 in any trim you want with 256GB.",still start go storage base ultra start go storage base offer go go option get trim want go
589,589,2,81.48,"phone, year, fix, pro, people, use, like, samson, make, get, buy, one, apple, think, even, goose, look, come, still, see","Looking at it from another perspective, apple tends to introduce features on the pro series first and then they trickle down to the other phones later. 
This is one feature that hasn’t trickled down even after 3 new generations. Likely not because of cost savings, but because they know it’s a feature that enough people want which causes them to go for a pro. ",look another perspective apple tend introduce feature pro series first trickle phone later one feature trickle even new generation likely cost saving know feature enough people want cause go pro
835,835,2,80.8,"phone, year, fix, pro, people, use, like, samson, make, get, buy, one, apple, think, even, goose, look, come, still, see","Let me guess you are the type of people who think non removable apps are completely not bloatware because they are made from Google right? You can talk about Samsung having bloatware when you can uninstall, replace, remove any of the google apps that are forced upon you in the Pixel, which is not the case at the moment. You can't remove the stupid Google search in the Pixel but that's not bloatware right?",let I guess type people think non removable completely bloatware make goose right talk samson bloatware instal replace remove goose force upon fix case moment remove stupid goose search fix bloatware right
490,490,2,80.27,"phone, year, fix, pro, people, use, like, samson, make, get, buy, one, apple, think, even, goose, look, come, still, see","Can’t wait. This is gonna be the phone I drive into the ground. Won’t need to upgrade for a good long time. This phone has all but literally one feature I need and removing the notch isn’t terribly important to me anyway. At least not right now.

I’m looking forward to the iPhone 26 now lol",wait na phone I drive ground need upgrade good long time phone literally one feature I need remove notch terribly important I anyway least right look forward phone
164,164,2,80.26,"phone, year, fix, pro, people, use, like, samson, make, get, buy, one, apple, think, even, goose, look, come, still, see",I think people should accept the fact that we are on the smartphone era when it is hard to have big upgrade every year. Samsung already uses the latest and greatest components on their flagship every year.,I think people accept fact smartphone era hard big upgrade every year samson already use late great component flagship every year
993,993,2,80.05,"phone, year, fix, pro, people, use, like, samson, make, get, buy, one, apple, think, even, goose, look, come, still, see","I literally just traded in a 3 year s22u and got an s25u plus buds3 pro for like $700 AUD. The pre-order discounts make it easily cheaper than any other flagship phone, including last year's model.",I literally trade year get plus bud pro like recorder discount make easily cheap flagship phone include last year model
972,972,2,79.79,"phone, year, fix, pro, people, use, like, samson, make, get, buy, one, apple, think, even, goose, look, come, still, see","> All phones released, and upcoming by every other brand aside from Samsung and google are using silicone carbon.

So buy one of those phones instead? That's the whole point of Android, choice. Instead of bitching about what the latest phone doesn't have you can just go and buy the phone that does have it.",phone release come every brand aside samson goose use silicone carbon buy one phone instead whole point andros choice instead itch late phone go buy phone
229,229,2,79.58,"phone, year, fix, pro, people, use, like, samson, make, get, buy, one, apple, think, even, goose, look, come, still, see","I don't see how people see this as inherently bad. 

We don't have to buy a new phone every year anymore. We achieved peak technology in the palm of our hands. A great camera, a lot of storage, capable of gaming and reading anywhere. Every year it improves slightly, but not enough to make us feel like we need to buy the new one. 

This wasn't on purpose, but I feel like the standardization of the premium smartphones is good for my consumerist mind. I have a S23 and I will only buy another phone when this one dies.",I see people see inherently bad buy new phone every year anymore achieve peak technology palm hand great camera lot storage capable gaze read anywhere every year improve slightly enough make feel like need buy new one purpose I feel like standardization premium smartphone good consumer mind I I buy another phone one die
745,745,2,79.53,"phone, year, fix, pro, people, use, like, samson, make, get, buy, one, apple, think, even, goose, look, come, still, see","I agree that tensor and Snapdragon are completely different ball games, tensor is shit compared to SD However if you're not a heavy user or use a phone for gaming the pixel is a very solid phone. I'm looking forward to the TMSC pixel 10",I agree tenor snapdragon completely different ball games tenor shit compare sd however heavy user use phone gaze fix solid phone I look forward tm fix
683,683,2,79.53,"phone, year, fix, pro, people, use, like, samson, make, get, buy, one, apple, think, even, goose, look, come, still, see","The original iPhone was a premium product. Just like these are. They should have the premium features to match. Not all of them. They still need to sell Pros, but every single other phone at this price has 120hz. Just because people may not notice it doesn't mean it shouldn't be there",original phone premium product like premium feature match still need sell pro every single phone price people may notice mean
201,201,1,79.53,"well, camera, ultra, go, would, get, phone, like, samson, new, use, still, launch, time, screen, battery, really, also, thing, take","Better processor, 4gb more ram, refreshed and bigger screen, more nits/brightness. Updated ultrawide camera. Faster wireless charging.

I mean its not that bad of an update, even from s24u.
And anything before s24u is worth the upgrade right away.",well processor go ram refresh big screen nitsbrightne update ultrawide camera fast tireless charge I mean bad update even anything worth upgrade right away
1103,1103,2,79.44,"phone, year, fix, pro, people, use, like, samson, make, get, buy, one, apple, think, even, goose, look, come, still, see","Yeah, I once bought an Iphone and was kinda hyped to use imessage, of all my contacts only my therapist had it enabled but she still didn't use it lmao.

Now I'm experiencing the same with RCS, except in this case many more people have it enabled. They still use Whatsapp, god damn it.",yeah I buy phone kind hope use message contact therapist enable still use may I experience ra except case many people enable still use whatsap god damn
785,785,2,79.13,"phone, year, fix, pro, people, use, like, samson, make, get, buy, one, apple, think, even, goose, look, come, still, see","Idk man, [Infinity Nikki](https://x.com/pearpal_nikki/status/1859883303349964807?s=19), a game that came out in December 2024, already set the record for the most demanding minimum & reccomended specs (Dimensity 8200/Snapdragon 888 minimum, Dimensity 9200/Snapdragon 8 Gen 2 reccomended)




And [Arknights: Endfield](https://youtu.be/UbMmSdOJ1Ho?si=XMvYq6feYgbwToDN) is already shaping up to be the most demanding game of 2025, bc of both it's graphics and the fact that it's a factory builder, a genre known to be very CPU intensive",ink man infinity nikihtpsxcompearpal_nikistatus game come december already set record demand minimum recommend speck diversity snapdragon minimum diversity snapdragon gen recommend knights endfieldhtpsyoutubeubmsdojhosixmvyqfeygbwtodn already shape demand game bc graphic fact factory builder gene know cup intensive
635,635,2,79.11,"phone, year, fix, pro, people, use, like, samson, make, get, buy, one, apple, think, even, goose, look, come, still, see","Last phone I had that had 120hz was a galaxy s21. 

Guess what feature I had to turn off if I even wanted that phone to last 3 hours. It looked beautiful but it just ATE the battery between the refresh and the processor keeping up. 

It's a useless feature for phones still. That battery chewing is the reason apple doesn't implement it and honestly I don't care for it on a mobile device. I'd much rather have smooth animations at 60hz and an all-day battery even with games.",last phone I galaxy guess feature I turn I even want phone last hour look beautiful eat battery refresh processor keep useless feature phone still battery chew reason apple implement honestly I care mobile device I would much rather smooth animation allay battery even games
637,637,2,79.03,"phone, year, fix, pro, people, use, like, samson, make, get, buy, one, apple, think, even, goose, look, come, still, see","I think Apple knows the target buyer of a non Pro phone doesn’t care about 120hz and is unlikely to notice it, the software is optimized enough anyway.  

One of those buyers would be my mother, she’s seen 120hz content on my 120hz oled and can’t tell the difference between that and 60hz content on a 60hz tv.

It’s just another meaningless number to some people.",I think apple know target buyer non pro phone care unlikely notice software optimize enough anyway one buyer would mother see content old tell difference content another meaningless number people
327,327,2,78.98,"phone, year, fix, pro, people, use, like, samson, make, get, buy, one, apple, think, even, goose, look, come, still, see",I only do it because it makes sense to upgrade every year. If Google fi wants to keep offering me the latest with no trade in for $600 and I can easily sell my old one for $600 why not upgrade?,I make sense upgrade every year goose I want keep offering I late trade I easily sell old one upgrade
682,682,2,78.18,"phone, year, fix, pro, people, use, like, samson, make, get, buy, one, apple, think, even, goose, look, come, still, see","I disagree. They might not care about 120hz vs 60hz, but they will care when they look at them both and see one isn’t as smooth as the other.

Of course not everyone, but having sold phones for 8 years when the average customer saw the first iPhone with a 120hz display they more often than not much preferred the look of the display over the 60hz model without needing to understand the numbers behind it",I disagree might care vs care look see one smooth course everyone sell phone year average customer see first phone display often much preferred look display model without need understand number behind
398,398,1,78.15,"well, camera, ultra, go, would, get, phone, like, samson, new, use, still, launch, time, screen, battery, really, also, thing, take","A better chip with significant improvements like this means that they can output the same amount of performance with a significantly lower TDP and significantly higher lows. This means potentially better battery life for the same workload and capacity, significantly less noticeable stutters, significantly fewer scenarios where the chip would thermal throttle thus leading to consistently lower temperatures, and better longevity if you're holding onto the phone for more than 2 years.

It's the same reason why getting a better engine on a car makes a noticeable difference even if you're not going to drive it faster than you normally would on the road. Higher torque and horsepower gives better efficiency and better control, which are both qualities that are useful even in day to day use",well chip significant improvement like mean output amount performance significantly lower top significantly higher low mean potentially well battery life workload capacity significantly less noticeable shutter significantly scenario chip would thermal throttle thus lead consistently lower temperature well longevity hold onto phone year reason get well engine car make noticeable difference even go drive fast normally would road higher true horsepower give well efficiency well control quality useful even day day use
310,310,2,78.06,"phone, year, fix, pro, people, use, like, samson, make, get, buy, one, apple, think, even, goose, look, come, still, see","Yeah but my S23 is still a beast for what it is, I wanna see them manage power consumption on those beasts in such a small phone.
They'll eventually get it right w some updates and that's y I'll never buy a Samsung phone at launch but wait at least one year like I did w this one haha.",yeah still beast I wan na see manage power consumption beast small phone eventually get right w update I never buy samson phone launch wait least one year like I w one hata
