,Unnamed: 0,Comment ID,Comment Body,Author,Upvotes,Timestamp,Cleaned_Comment,ClusterLabel,actual_sentiments
11,74,lnuzh3l,It does not look choppy.,Deleted,-1,1726728178,look happy,5,positive
48,68,lntlqh6,Well I’m coming from a 12 mini an upgrade to a 16. never had 120 Hz on my phone and don’t feel at all like it is choppy.,Niightstalker,5,1726705158,well come mind upgrade never phone feel like happy,12,negative
13,34,lnulyd1,Nah they will do 75hz so strikes a good balance 😜 as then do 90 and in a few years 120hz,aspenextreme03,5,1726720205,ah strike good balance year,6,positive
22,126,lnxsjys,Someone's not a fanatic for telling you they think 60hz is choppy.,FlarblesGarbles,1,1726771385,someone fantastic tell think happy,7,negative
55,206,lntg62d,Literally any time you swipe or scroll or any kind of animation yea it’s noticeable,TwoMoreMinutes,9,1726703069,literally time wipe stroll kind animation yea noticeable,14,negative
51,245,lnv8d40,So you're fine with a $800 iPhone having a lower refresh rate than $150 androids for no good reason whatsoever?,Shaykea,1,1726734380,fine phone lower refresh rate andros good reason whatsoever,12,negative
33,89,lnv40ts,"When you adjust for inflation, basically any computing device is incredibly cheap compared to 20-30 years ago. We don’t know how good we have it.",Forte69,1,1726731259,adjust inflation basically computing device incredibly cheap compare year ago know good,10,positive
0,0,lnt9dc3,You only need one guess to know the theme of the top comment on this post,Portatort,263,1726700551,need one guess know theme top comment post,0,positive
15,78,lnu6g18,"> usb2

I agree, and yet realistically how many people these days are uploading files to/from their iPhone by cable these days? If it’s anyone I imagine it’d be Pro phone users.",SkyGuy182,0,1726713084,I agree yet realistically many people day unload file phone cable day anyone I imagine pro phone user,6,negative
23,150,lnwfg11,"""Good thing I have this 120hz display so i can watch Netflix at 24fps"" is how this all sort of falls.

There's not a whole lot that we do on our phones that doesn't boil down to ""it's nice when it scrolls""",bran_the_man93,3,1726755582,good thing I display I watch netflix fas sort fall whole lot phone boil nice school,7,negative
27,170,lnv02h8,"It really does not. I’m using 240hz screen on my PC, I’ve had 120hz phones but I’m perfectly ok with my iphone 15. It does not feel choppy at all.",Deleted,0,1726728565,really use screen pp give phone perfectly ok phone feel happy,8,positive
34,101,lo3ihhf,"Sure, but it would also generate more sales",makeflippyfloppy,1,1726859756,sure would also generate sale,10,positive
47,13,lnx4eql,Why dont they just increase the price $50 and add 120hz? Release an SE phone at the same time. They would have so many sales,makeflippyfloppy,1,1726763829,increase price add release se phone time would many sale,12,negative
49,129,lnt1ine,this would apply if youre not doing anything with your phone 😂 like staring at a static image. how often are you touching and using your phone? ,tensei-coffee,-6,1726697704,would apply anything phone like stare static image often touch use phone,12,negative
37,175,lnvhv7u,"I agree with what you’ve said - but 120hz is not the same as “1000 songs in your pocket” or “an iPod, a phone, an internet communicator”.

It’s a smoother, more responsive screen, on top of one of the best smartphones on the market. 120hz is great. I think every phone should have it. I’m not “making excuses”. I’m just telling you that for a fact, many people can not tell the difference.

Nice username btw",sheeplectric,0,1726740975,I agree say song pocket upon phone internet communication smoother responsive screen top one well smartphone market great I think every phone make excuse tell fact many people tell difference nice surname bow,10,positive
5,233,lnxeuar,What do you mean by something else? They already have a lot of stuff on the base models that is slightly worse in some way. Battery life. Display brightness. Cameras. Materials. Not much else they could downgrade lol,Kavani18,2,1726767079,mean something else already lot stuff base model slightly bad way battery life display brightness camera material much else could downgrade,2,negative
30,82,lnutylw,"lol, this is it. 

Yes there’s a difference. Yes people like us can tell the difference and appreciate it. But the average iPhone user doesn’t care. It’s like that motion-smoothing feature on your parents tv that they just left on, even though it looks awful. They don’t know the difference, or it’s of minimal importance to them even if you showed them the difference.

The reality is that if you’re on the Apple subreddit, you’re probably who the “Pro” is aimed at.",sheeplectric,-6,1726724695,yes difference yes people like tell difference appreciate average phone user care like motionsmothe feature parent leave even though look awful know difference minimal importance even show difference reality apple subredit probably pro aim,10,negative
9,58,lnu5jx3,Looks you’re wrong pal,Cedric182,-2,1726712724,look wrong pal,5,negative
10,103,lnupz01,Pal looks you're wrong,Portatort,1,1726722364,pal look wrong,5,negative
19,183,lnvnwll,"I think you’ve overestimating people. If you didn’t ask them to look for it, most wouldn’t notice it. 

‘Pro’ is a meaningless marketing term so I don’t see any reason to gatekeep it",Forte69,0,1726744398,I think overestimate people ask look notice pro meaningless marketing term I see reason gatekep,7,negative
20,242,lnvpjbv,"Weird, given the sales numbers don’t reflect your opinion at all.",Deleted,3,1726745205,weird give sale number reflect opinion,7,negative
25,40,lnt7nov,Does anyone here use the always on display? It felt very weird having it on,TheNextGamer21,35,1726699927,anyone use always display feel weird,8,negative
43,53,lnum8zl,"The 60hz defenders are crazy

These people would be defending Apple if the phones had 30hz lmao",WickedTwista,4,1726720359,defender crazy people would defend apple phone may,12,negative
46,217,lntzl7a,Can't believe there still exists Apple fanboys making these stupid arguments in 2024.,Deleted,5,1726710385,believe still exist apple fanboy make stupid argument,12,negative
18,93,lnt9qsi,"I hated it on my 15 pro, and turned it off almost immediately. I always thought my phone was lighting up with a notification.",3serious,32,1726700689,I hate pro turn almost immediately I always think phone lighting ratification,7,negative
