Comment ID,Comment Body,Author,Upvotes,Timestamp
ml4o118,Puede gumawa ng list ng products imported sa america? Gusto ko iwasan mga ito. Irita kasi ako Dyan sa ginagawang tariff ni trump,laswoosh,1,1743644197.0
ml40403,"Bakit galit na galit mga tao dito? Based sa pic, ang Pinas ay nag chacharge ng 34% tariff sa US and 17% lang ang ipapatong  ng US. Its reciprocal guys, we charged them high, they charged us back.",rjreyes3093,-3,1743635901.0
ml3kgb3,He said he will lowering the Tax for Americans to balance it out with this Tariffs. Let's see how this will play out in the coming months or weeks.,Succre1987,-1,1743630780.0
ml3tsiu,So much for our gracious ally lmao. Sige dikit pa kayo kala niyo may mapapala pa kayo.,lunamarya,-2,1743633807.0
ml4j412,"implementing ""reciprocal tariffs"" means the US is placing the exact same tariffs on PH goods that PH also places on US goods. why is that unfair or wrong? equal is equal. if PH removes the tariffs on US goods, then the US tariffs on PH goods also goes to 0.",xDolphinMeatx,-1,1743642456.0
ml4q95j,"So it is wrong for the US to try to level the playing field, OP?",rcpogi,-3,1743644977.0
ml421oh,Hoping the Simpsons episode comes to fruition by April 12.,Throwbackmeme_01,0,1743636546.0
ml4gzj5,"He is a paid Russian stooge. After America's allies are no longer allies America can no longer be a threat to Russia and China. After destroying USA Trump will retire with billions of money from stealing his nation's funds and selling off their secrets. Both Putin and Xi Jinping are giving him money. 

Sad that plenty of Filipino Americans voted for him. American exceptionalism is no more. China is the next world power. And kawawa ang Pinas dahil gustong gusto tayong angkinin ng China. Papa rape nlng tlga tayo. Ansaya ng mga DDS nyan malamang. Hayyst.",99thAlt,-1,1743641705.0
ml49mhu,"WOW! Salamat po, Tatay Donnie ! 🥰🥰🥰",Malgalad_The_Second,0,1743639120.0
ml4mrkh,"Isn't 17% a decent number? It's basically just a profit margin. Nasanay na lang mga tao sa free trade but business wise, its not outside the realm of fairness.",IQPrerequisite_,0,1743643752.0
ml5hu3j,"Not to sound contrarian but If i were an American, this might benefit me. The us has been delcining and getting overtaken by China. He's trying to make the US richer than it already is. Time will tell if it works or if it will make a bigger hole for them",SpogiMD,1,1743656526.0
ml6fi8y,"It's only isolationist if nobody wants what you have. Let's be real here, we all love everything from the US, we try to act like them, dress like them, buy their shit, we literally wait for them to tell us what's good. We really expect them to act out of the kindness of their hearts when they're 37 trillion in the hole?

Influence and Entertainment is America's no. 1 export, and the world will never tire of them.",Beneficial-Pin-8804,1,1743676802.0
ml6tn2c,That’s just half the rate Phils imposed on US goods.,TingHenrik,1,1743683206.0
mlae8wu,Explain in DDS Fanatic terms,Turbulent-Cattle9543,1,1743723297.0
ml5q7m5,"People don’t seem to understand or know is that Philippine government has been charging US a import tax of 34% for years.  Now US is trying to balance the trade tax imposed.  
Look at the chart that president Trump is holding and showing people. 
So at the end, Philippine is still charging US more import taxes than US charging Philippine.",panda1491,1,1743661127.0
ml66ngo,America is doing great right now. He's doing a great job. Stats shows. Even his popularity votes went up. And some random redditors think they know how to handle america better. Typical pinoys. Mga mamaru. HAHAHA,Steeeeeeeeeeeb,1,1743671525.0
ml4j2sy,Sometimes mapapaisip ka talaga kung totoo nga talagang agent ng CCP/Russia tong si Trump eh. MAGA ang ideology na magpapabagsak sa America. Mala-Great Leap Forward ang dating.,TheDonDelC,179,1743642443.0
ml3v9pn,"Di magexist ang america if nawala ang global trade sa kanila. 
Wag na kayo mag america guys if ever. Di naasenso doon.",CallOfTheCurtains,148,1743634298.0
ml7tyqj,As a pinoy in america who for some reason is only one of few who actually hate trump here. Tbh its embarassing seeing the stupid filipinos who love trump and say duterte should be free... i love our country but wth,a_doody_bomb,1,1743694951.0
ml3y16t,Di naman. Wala pang tariffs Russia saka NoKor,ILikeFluffyThings,16,1743635217.0
ml3knxu,"If nag solo ang America, ready ka na ba maging part ng China?",Succre1987,15,1743630845.0
ml42zfl,[removed],Deleted,1,1743636861.0
ml7hwet,[removed],Deleted,1,1743691405.0
ml4si9e,"South Korea, China and Japan apparently are planning to have a joint response to the tarrifs while also bolstering their own trade tries with each other.j",mhrnegrpt,0,1743645778.0
ml52zj0,Just as Putin planned para humina ang US dahil nabawasan ng allies.,melperz,0,1743649814.0
ml48d64,That's what they did during 1929. Economy tanked and the billionaires swooped in and bought everything.,bad3ip420,81,1743638680.0
ml3ryq5,He's doing the Marcos Sr. way,MikeDCollector,94,1743633197.0
ml3qc0y,How much tariff The Philippines charged on US goods?,Sad_Zookeepergame576,25,1743632664.0
ml5oxuv,"Yes, I've heard one talked about this I think in some local US news channel. That he's pro for the corporations talaga, and di nagets yun ng mga MAGA. I heard na gusto niya din babaang ang corporate tax dba? Idk man, one side of me still hopes na sana mapanindigan ng MAGA yang mga paniniwala nila, kasi if this thing goes into deep sht, apektado din naman sila, tayo.. pero more of sila.",BeginningImmediate42,1,1743660384.0
ml3pxfz,[removed],Deleted,1,1743632532.0
ml5cohh,"It's concerning, recent [article](https://www.nbcnews.com/politics/donald-trump/trump-third-term-white-house-methods-rcna198752) mentioned of his intentions to run a 3rd term.",ZetaMD63,1,1743653996.0
ml5qaxc,"How will it tank the economy?  Every single country on the list tariffs US goods, do they do that to tank their economies?  


The idea is to produce more goods in the US and reduce trade deficits.  The US can't afford giant trade deficits anymore.",Antique-Resort6160,1,1743661183.0
ml4gr0i,Juskolord,MidnightMeowMeow,0,1743641621.0
ml3j0ty,"I highly doubt we would retaliate aggressively. Even with such an eggregious imposition of tariffs, we're still one of the countries with the lowest %. Most likely, Malacanang will wait and see how other SEA countries would react here. If anything, this might actually be a good thing for us, because the countries we are competing with have more tariffs imposed upon them.

* China - 34%
* Vietnam - 46%
* Taiwan - 32%
* Japan - 24%
* India - 26%
* South Korea - 25%
* Thailand - 36%
* Indonesia - 32%
* Malaysia - 24%
* Cambodia - 49%
* Bangladesh - 37%
* Singapore - 10%
* Philippines - 17%",baybum7,219,1743630343.0
ml5724h,Jr like his father is a US bootlicker so he'll just take it up the ass  to appease Trump.,ArtisanMemer,1,1743651492.0
ml4xsyz,Marcos is a right wing President like Trump so he won’t,rsgreddit,0,1743647763.0
ml3jqcx,"Haven't you heard? We just got a billion dollar deal of new US fighter jets in form of ""aid"" yesterday. 

This admin would grumble but nothing will come out of it.",EmotionalLecture116,-7,1743630560.0
ml59opl,Didnt he just meet with Pete Hegseth? Lol what a way to greet your allies.,shawarmaconquistador,0,1743652634.0
ml4mccy,Sana madeport ung friend ko sa fb na gigil pag ka idol ka trump at elon musk.,Fit_Industry9898,27,1743643602.0
ml3zhbf,God save the Republic,DisintegrationDream,8,1743635691.0
ml5nge2,[removed],Deleted,1,1743659539.0
ml5vfgi,Sa sardinas at corned beef na nga lang sumasaya mag mamahal pa lalo. Iyak na lang talaga hahahaha.,mikemtnz,1,1743664278.0
ml4a91m,"Mang Tomas prices will go through the roof in California. Also, my Yeti gear will become more expensive 😭",SBTC_Strays_2002,53,1743639342.0
ml4e6qb,He even included a group of islands whose only population are penguins.,YZJay,18,1743640726.0
ml82a45,sinali nga nya isang antartic island. tinaripahan mga penguin 🐧 🤣,lavenderlovey88,1,1743697411.0
ml3p7y4,[removed],Deleted,1,1743632299.0
ml4x0ve,"from the US perspective, the PH has a very protectionist economy that gives subsidies to farmers and fishermen among other actions.

the US cannot compete with that kind of protectionist competition.

from the US POV, this is just payback.

from the PH perspective, this will probably hurt PH companies who sell to the US.",Menter33,0,1743647464.0
ml4ux4r,"No they won’t. It will take probably a decade to restore manufacturing. Plus, Americans won’t take manufacturing jobs, thats what illegal immigrants do",reggiewafu,43,1743646669.0
ml49upb,"He's doing what his masters Musk, Thiel and Putin tell him to do",Malgalad_The_Second,20,1743639200.0
ml4s9dk,"As someone from the manufacturing sector, it takes years to plan and build a factory from the ground up. Aside from the supply chain, hiring skilled individuals and other logistical issues. I honestly don't understand the thought process. By the time his term ends(?), that's the only time the factory can manufacture (at loss).",Enryumazino88,12,1743645689.0
ml486c0,"if you do research, he is more like following orders of his sponsors.",esdafish,51,1743638614.0
ml4auwq,Tariff lang naman ang alam niyan. Parang alam mo yun first time mo matutunan yung word tapos ginagamit mo na sa lahat na bagay. Hahaha,Sponge8389,17,1743639558.0
ml5kalg,thats actually his plan to feed the rich dawg,itsfreepizza,1,1743657815.0
ml5nrn8,That's actually what they're going for I think. They'd rather have total control of a poorer country than to share control of richer one.,Teantis,1,1743659712.0
ml4i1tq,"Basa ko pa ang nonsense rin ng computation. Ratio lang ng import-export x 100%.
Kahit walang tariff or surplus yung trade ng america minimum 10% kaya karamihan ng nasa list 10%.

Walang sense or reason yung tariff",anemoGeoPyro,0,1743642079.0
ml6tv1b,I think Hitler’s rise to power was a little more complicated than “America bad”… ,Trick_Definition_760,1,1743683296.0
ml4g83t,What is old is new again. Bastard wants the 19th century America back.,angrydessert,24,1743641436.0
ml4ocdn,Rare R* W. Just waiting for GTA 6 reference.,ahrienby,11,1743644310.0
ml4unql,Dafuq. That is some Simpson-like-Family-Guy prediction right there. Whoa,Revolutionary_Ad5209,3,1743646572.0
ml4trx9,The main damage here is done to the reputation of usa as a stable and consistent partner/ally. China just have to sit back and relax and watch Usa implodes on its own.,VernaVeraFerta,14,1743646242.0
ml5qxaw,Wait wdym??,BeginningImmediate42,1,1743661548.0
ml45fz5,I'm not sure that BPO is included dahil goods lang yan. Not services.,Minimum-Friendship70,28,1743637682.0
ml44n4f,"I have limited knowledge lang din pero kagaya nung isang comment dito maraming nang factors ang naghihinder like foreign ownership, cost of electricity, number of holidays, typhoons and earthquakes and infrastructure. Correct me if I am wrong.",Ls_allday,4,1743637416.0
ml4m9l7,Ang threat lang sa bpo sa pinas is ndi tarriffs kundi ung ai automation.,Fit_Industry9898,4,1743643575.0
ml4x0ud,"Moving manucturing is expensive, from what i've heard specifically for chinese goods moving to the us. It was easier to find loop holes in moving goods than moving to a country with lower tariffs.",hokuten04,2,1743647464.0
ml53v1s,"I’m in the boat that while this devastates everyone, we are actually going to be left in a more favorable position than the rest of our SEA neighbors, sans Singapore, which doesn’t manufacture much themselves.

Malay mo dito lumipat un Nike. Impossible na yan maka operate sa Vietnam. All our major SEA competitors sa export, pilay now due to this.

Finally may halaga na un mga Pampanga at Bulacan, maybe?",camille7688,2,1743650168.0
ml4sutw,"We can lower our tariffs, so they will also lower theirs.  

[https://www.jpost.com/business-and-innovation/all-news/article-848401](https://www.jpost.com/business-and-innovation/all-news/article-848401)",hellcoach,1,1743645905.0
ml5o9uy,[removed],Deleted,1,1743660002.0
ml7ig7v,"Heard PEZA's approved investments are up 294.26% compared to the first quarter of last year, which is good but such big projects will still take at least a few years before fully materialising, but at least the Philippines have some momentum going now.",haha_hmmmm,1,1743691569.0
ml3jwbt,"Mainly electronics and machinery we're exporting to the US. But afaik, this is a blanket tariff, so all exports to the US is affected.

[https://tradingeconomics.com/philippines/exports/united-states](https://tradingeconomics.com/philippines/exports/united-states)",baybum7,25,1743630610.0
ml3jxs7,I know sugar is one. I read an article that we'll be able to export 800MT by next month.,No-Homework273,4,1743630622.0
ml564no,I think bananas din? Pano kaya nila mameet supply di naman same climate natin haha,Sea-Actuator-5782,1,1743651098.0
ml5quqh,bruh 😭😭😭,xxtiramisu,1,1743661505.0
ml7mdng,Nooooo 😭,AdEducational1448,1,1743692721.0
ml4f0ch,"Funny no? Only Russia and North Korea do not have any tariffs imposed on them today, lol

What a day to live in.",baybum7,8,1743641014.0
ml3pv8m,Here's what's going to happen. A lot of their products will start passing thru us via backdoor. e.g. Slap Made In The PH labels when in reality it came from China & Vietnam. ,brat_simpson,39,1743632512.0
ml4ze4q,Ang concern ko dito is tataas ang presyo lalo ng mga sapatos. Mostly gawa sa VN at CN,BarrackLesnar,1,1743648379.0
ml3wv90,"United States Exports to Philippines	Value	Year

Electrical, electronic equipment	$2.79B	2024

Oil seed, oleagic fruits, grain, seed, fruits	$863.34M	2024

Cereals	$773.80M	2024

Machinery, nuclear reactors, boilers	$767.88M	2024

Meat and edible meat offal	$417.32M	2024

Aircraft, spacecraft	$383.92M	2024

Residues, wastes of food industry, animal fodder	$360.73M	2024

Dairy products, eggs, honey, edible products	$343.04M	2024

Optical, photo, technical, medical apparatus	$299.55M	2024

[https://tradingeconomics.com/philippines/exports/united-states](https://tradingeconomics.com/philippines/exports/united-states)",baybum7,13,1743634829.0
ml3xa21,good question lol,mcdonaldspyongyang,1,1743634968.0
ml4tn8s,Services. BPO and OFWs na di covered ng tariff. Goods - mostly electronics. Our export sector is not that huge compared with other Asean countries.,Minimum-Friendship70,1,1743646194.0
ml44u8u,Lucky Me Pancit Canton,nikewalks,-1,1743637480.0
ml3xb2w,"Even the economists are baffled and confused bakit ganito ginagawa niya. Pero some of the theories are:

* It's a simple-minded promise he can say to his voters as something he did to ""protect America""
* It's a backhanded tax increase to the working class, while giving the rich more tax breaks
* Trump is trying to crash the economy so the rich americans can buy stocks and other comodities in the cheap, and further increasing their wealth",baybum7,26,1743634977.0
ml3p3g4,No substantial amount of business will go to the Philippines. The electrical grid is expensive and unreliable. The red tape here is onerous and there are laws against foreign ownership of corporations. I could go on but you get the picture.,Temuj1n2323,67,1743632259.0
ml462b8,"Hindi tariff ang problem why investors don't go here. It's our high electricity rates, relatively high labor cost compared with our other Asian neighbors,  the high cost of doing business, inconsistent policies because of change in administration every 6 years, etc. ",Minimum-Friendship70,11,1743637893.0
ml48sk3,Sa Brunei and Timor Leste na lang daw sila kasi 10 percent lang hahahha,throwables-5566,2,1743638829.0
ml4p7ez,"We can’t really push it down any much further because the our tariff rates are already very low. The figure cited by Trump is a very badly calculated one, practically made up.

Our actual average tariff rates imposed on US goods is [3.3%](https://www.bworldonline.com/top-stories/2025/03/28/662328/dti-confident-phl-will-not-be-affected-by-us-tariffs/)",TheDonDelC,2,1743644613.0
ml3ovpv,[removed],Deleted,1,1743632190.0
ml4mlht,Sa pinag ggawa nila duterte i wonder if magging promising ang pilipinas sa mga foreign investors. Ngayon ngayon palang tayo makakarecover pero dama pa din mga kagaguhan na gnawa ni duterte before,Fit_Industry9898,1,1743643693.0
ml3sc59,"wait and see muna tayo, mahirap naman pag pilipinas lang ang wala sa listahan, baka mas lalo tayo i bubully ng SEA countries",koolins-206,0,1743633323.0
ml3wdub,Can you elaborate further about what that bail out means? Genuinely curious wth is he trying to accomplish eh,suffer_hero,2,1743634667.0
ml4uzda,"Kahit gustuhin kung yung pamunuan ng AFP at gobyerno e patay na patay sa Amerika, wala rin.",mhrnegrpt,0,1743646691.0
ml42t21,"Nope, they are claiming that we're imposing 34% tariffs for importing US products. And this is the supposed justification for imposing a reciprocal tariff with another claim that it's dicounted on the yellow column, which for us is 17% - and will be presumably on top of any other existing tariffs they are charging already for certain products.",baybum7,12,1743636801.0
ml4y5gm,I think PH mainly exports labor more than goods abroad and Trump tariffs are targeted towards goods so affected dito is the likes of sugar and our other tropical exports.,dumpling-loverr,1,1743647897.0
ml3i4sa,"The products we export to the US will be affected, not the items we import to the Philippines.",baybum7,49,1743630066.0
ml3sjpm,"Nope. Importers lang ang affected pero tyo? hindi. Gusto talaga ni Clown na pilitan yung mga citizens to buy ""American Made"" goods. Ang tunay na makikinabang diyan ay yung si Clown at mga kaibigan niya.",ShallowShifter,8,1743633394.0
ml3xi7j,"No. Whatever they buy from us, they will have to pay 17% there. We have not issued retaliatory tariffs...yet.",stpatr3k,3,1743635042.0
ml3viba,"To be fair, out of all the SEA/Asian countries, we have one of the lowest additional tariffs. We're not special, but we're not on the other side of that as well.

* China - 34%
* Vietnam - 46%
* Taiwan - 32%
* Japan - 24%
* India - 26%
* South Korea - 25%
* Thailand - 36%
* Indonesia - 32%
* Malaysia - 24%
* Cambodia - 49%
* Bangladesh - 37%
* Singapore - 10%
* Philippines - 17%",baybum7,12,1743634377.0
ml4bshz,Blame Roger Stone for the goddamn idea that real estate baron be made president.,angrydessert,2,1743639884.0
ml48oyz,"This should ideally have no effect sa food price sa pinas. The tariff will only be for products we are exporting to the US.

Food that we are producing within the PH, or any other food we are importing from all countries are ideally unaffected by this.

Edit: Unless you're a pinoy in the US? Then yeah, you're going to be paying 17% more for that Mang Tomas.",baybum7,7,1743638795.0
ml3vtq0,"Imposing this kind of unilateral tariff will actually push more countries towards China, or at the very least, away from the US.",baybum7,20,1743634482.0
ml3ydf9,"No. Hindi nila kaya. 

Last time they did this BS was Smoot Hawley Tariff before WW2 or mostly known as “The Great Depression”. 

Bobo lang talaga si Trump at yung mga DDS tier MAGA followers niya. Remember, this is a president and followers who politicized wearing a face mask.",Glass_Carpet_5537,14,1743635328.0
ml41yxa,"Di nila kaya.  They consume more than they can produce.  Coffee, for example, even their coffee in Hawaii is very expensive and it’s usually a blend na galeng ibang bansa.  Imagine if pure blend pa, di nila kaya and the price will also be expensive.  And kahit gawin pa ang buong Hawaii as a coffee plantation (not possible ofc), still cannot cover US consumption.  It only grows on certain parts of the world due to climate, so sa kanila Hawaii and maybe PR.  And it takes years to be able to harvest.  Good luck sa kanila to wait that long with no coffee at all.

Part of their states also rely on electricity from Canada.  Fuel is also a big factor, not sure if yung oil rigs nila are enough to sustain the entire country.

And their soybean farms are probably on the verge of collapse.  With the tariff wars going on, China is now doing business with Brazil and South Africa for that instead.  That’s a huge blow sa America kasi napakalaking export kasi nila to na mawawala sa kanila.

If they ever become “self-sustainable”, their prices will also go way up.  Who do you think is harvesting their food?  Without undocumented workers, they’ll be forced to pay more.  Sa labor pa lang, di na nila masusustain unless they’ll pay Americans more to do shitty jobs they don’t want to do.  And that’s how prices will go up as if they aren’t expensive already.",picklejarre,12,1743636520.0
ml44qbv,"The US is the world's biggest importer. It's the Americans who will suffer from high tariffs as it will boost inflation. Wala ring assurance that this will actually develop their manufacturing industry. The Philippines, although an exporter of goods ay di naman masyadong magsasuffer dahil di naman yun Ang pinakamalaki nating export. It's actually labor - OFWs.",Minimum-Friendship70,10,1743637445.0
ml4q0in,"Because Trump’s figures are practically just made up

https://preview.redd.it/e4r8616hzise1.jpeg?width=1784&format=pjpg&auto=webp&s=ad1aee082ccf22eda9f1bdcef9bf04fcb4d88a3a",TheDonDelC,6,1743644892.0
ml4bmik,"Inflation, taxes, surcharges, import duties.",angrydessert,4,1743639825.0
ml5b5d4,"It does lol. We are a major exporter of computer parts, machinery, and semiconductors.",321586,1,1743653289.0
ml3uaq5,"Hi u/ph_vic, your [comment](https://www.reddit.com/r/Philippines/comments/1jq0708/17_tariffs_imposed_on_the_philippines_trump/ml3uai9/) was removed due to the following:  
    - Your account did not meet the minimum karma requirements and wont be able to post and comment. We will not disclose the Karma threshold. This is to limit potential trolls and bad actors on the subreddit. If you use a throwaway account and need help, [let the moderators know](https://www.reddit.com/message/compose?to=%2Fr%2FPhilippines&subject=Requesting%20Assistance%20low-Karma).   

Please consider participating in other [Filipino related subreddits](https://www.reddit.com/r/Philippines/s/1rdCniBOBw) to increase your Karma before contributing in r/Philippines. Thank you for understanding  
***

*I am a bot, and this action was performed automatically. Please [contact the moderators of this subreddit](/message/compose/?to=/r/Philippines) if you have any questions or concerns.*",AutoModerator,1,1743633978.0
ml44dqq,"Trump is imposing tariffs under the justification that all the countries on his list are charging more for buying US products. He also claims this will encourage investors within the US to create more manufacturing jobs since imports will be more expensive now.

Economist feedback is mixed, and as far as I can tell, most of them do not agree with what Trump claims because things aren't as simple as that. That's why there are some who are thinking that Trump is deliberately crashing the US economy for self-serving reasons.",baybum7,4,1743637330.0
ml4c83t,"Hi u/_Internecine, your [comment](https://www.reddit.com/r/Philippines/comments/1jq0708/17_tariffs_imposed_on_the_philippines_trump/ml4c7xn/) was removed due to the following:  
    - Your account did not meet the minimum karma requirements and wont be able to post and comment. We will not disclose the Karma threshold. This is to limit potential trolls and bad actors on the subreddit. If you use a throwaway account and need help, [let the moderators know](https://www.reddit.com/message/compose?to=%2Fr%2FPhilippines&subject=Requesting%20Assistance%20low-Karma).   

Please consider participating in other [Filipino related subreddits](https://www.reddit.com/r/Philippines/s/1rdCniBOBw) to increase your Karma before contributing in r/Philippines. Thank you for understanding  
***

*I am a bot, and this action was performed automatically. Please [contact the moderators of this subreddit](/message/compose/?to=/r/Philippines) if you have any questions or concerns.*",AutoModerator,1,1743640036.0
ml4ghy0,"Hi u/Conscious_Plan_1335, your [comment](https://www.reddit.com/r/Philippines/comments/1jq0708/17_tariffs_imposed_on_the_philippines_trump/ml4ghwa/) was removed due to the following:  
    - Your account did not meet the minimum karma requirements and wont be able to post and comment. We will not disclose the Karma threshold. This is to limit potential trolls and bad actors on the subreddit. If you use a throwaway account and need help, [let the moderators know](https://www.reddit.com/message/compose?to=%2Fr%2FPhilippines&subject=Requesting%20Assistance%20low-Karma).   

Please consider participating in other [Filipino related subreddits](https://www.reddit.com/r/Philippines/s/1rdCniBOBw) to increase your Karma before contributing in r/Philippines. Thank you for understanding  
***

*I am a bot, and this action was performed automatically. Please [contact the moderators of this subreddit](/message/compose/?to=/r/Philippines) if you have any questions or concerns.*",AutoModerator,1,1743641531.0
