Comment ID,Comment Body,Author,Upvotes,Timestamp
ml3rbzg,"Not sure. But the actual list of countries with imposed tariffs is definitely longer than just 15 countries.

https://preview.redd.it/2eev6ef20ise1.png?width=1919&format=png&auto=webp&s=03914569284289ddf95309d7f5e0f45019d16dde",baybum7,16,1743632991.0
ml40r5d,"Vietnam, China, Taiwan and other SEA countries like Thailand, Indonesia and Malaysia are direct competitors for some industries like electronics, machinery, textile, food. So the lesser the imposed tariffs against us vs the other countries, the better our prospects can be in taking more of those industries and exporting to the US under more favorable terms vs the other countries with higher tariffs.

That's an oversimplified explanation - there will still be other considerations like ease and cost of doing business in the PH, but just considering the tariffs by itself, it's a con that we're going to cost more, but the pro is we won't cost as much as the other countries.",baybum7,38,1743636116.0
ml3v6q9,"Hi u/ph_vic, your [comment](https://www.reddit.com/r/Philippines/comments/1jq0708/17_tariffs_imposed_on_the_philippines_trump/ml3v6ed/?context=3) was removed due to the following:  
    - Your account did not meet the minimum karma requirements and wont be able to post and comment. We will not disclose the Karma threshold. This is to limit potential trolls and bad actors on the subreddit. If you use a throwaway account and need help, [let the moderators know](https://www.reddit.com/message/compose?to=%2Fr%2FPhilippines&subject=Requesting%20Assistance%20low-Karma).   

Please consider participating in other [Filipino related subreddits](https://www.reddit.com/r/Philippines/s/1rdCniBOBw) to increase your Karma before contributing in r/Philippines. Thank you for understanding  
***

*I am a bot, and this action was performed automatically. Please [contact the moderators of this subreddit](/message/compose/?to=/r/Philippines) if you have any questions or concerns.*",AutoModerator,1,1743634270.0
ml5rnkd,"Baliktad. Since it's a US imposed tariff, whenever a Philippine package gets imported papasok ng US, it's slapped with an additional 17% tax - which makes it more expensive for US citizens.",baybum7,1,1743661982.0
ml70ga2,US lost in vietnam war lols,veryshypachuchay,1,1743685764.0
ml3wsph,"Oh di ba? What are brothers for. Yuck.

Pero in fairness madaming gamit nila nandito na. F-16, Typhon Missiles, Patriot etc.",stpatr3k,2,1743634806.0
ml3zrd8,Kontrolado ng mga jew ang america matagal na,Jihyomas,-5,1743635783.0
ml56ypi,"Hi u/AdvancedVermicelli74, your [comment](https://www.reddit.com/r/Philippines/comments/1jq0708/17_tariffs_imposed_on_the_philippines_trump/ml56ynu/?context=3) was removed due to the following:  
    - Your account did not meet the minimum karma requirements and wont be able to post and comment. We will not disclose the Karma threshold. This is to limit potential trolls and bad actors on the subreddit. If you use a throwaway account and need help, [let the moderators know](https://www.reddit.com/message/compose?to=%2Fr%2FPhilippines&subject=Requesting%20Assistance%20low-Karma).   

Please consider participating in other [Filipino related subreddits](https://www.reddit.com/r/Philippines/s/1rdCniBOBw) to increase your Karma before contributing in r/Philippines. Thank you for understanding  
***

*I am a bot, and this action was performed automatically. Please [contact the moderators of this subreddit](/message/compose/?to=/r/Philippines) if you have any questions or concerns.*",AutoModerator,1,1743651452.0
ml4j9gu,"Na ban dahil sa preservative na gamit, but it's already been fixed and the ban has since been lifted, afaik",baybum7,24,1743642510.0
ml4fbnt,[removed],Deleted,1,1743641125.0
ml7p8a6,[removed],Deleted,1,1743693566.0
ml5nu9d,[removed],Deleted,1,1743659754.0
ml4hsla,"Hindi yan ""nonchalant"", ignorante siya. ganito rin siguro ang reason kung baket ilang beses na siya na bankrupt.",Sponge8389,7,1743641988.0
mlbamk1,"Hi u/OpportunityWarm40, your [comment](https://www.reddit.com/r/Philippines/comments/1jq0708/17_tariffs_imposed_on_the_philippines_trump/mlbamh6/?context=3) was removed due to the following:  
    - Your account did not meet the minimum karma requirements and wont be able to post or comment. We will not disclose the Karma threshold. This is to limit potential trolls and bad actors on the subreddit. If you use a throwaway account and need help, [let the moderators know](https://www.reddit.com/message/compose?to=%2Fr%2FPhilippines&subject=Requesting%20Assistance%20low-Karma).   

Please consider participating in other [Filipino related subreddits](https://www.reddit.com/r/Philippines/s/1rdCniBOBw) to increase your Karma before contributing on r/Philippines. Thank you for understanding  
***

*I am a bot, and this action was performed automatically. Please [contact the moderators of this subreddit](/message/compose/?to=/r/Philippines) if you have any questions or concerns.*",AutoModerator,1,1743735494.0
ml56jae,"This is actually a fact. Most of our exports are services.  
We are not an export oriented economy so the effect is not as harsh than vietnam or thai",arcinarci,8,1743651270.0
ml7ju6y,"As per Trump, there are no exemptions",baybum7,1,1743691975.0
ml40iw8,"Hi u/Additional-Peace3258, your [comment](https://www.reddit.com/r/Philippines/comments/1jq0708/17_tariffs_imposed_on_the_philippines_trump/ml40iul/?context=3) was removed due to the following:  
    - Your account did not meet the minimum karma requirements and wont be able to post and comment. We will not disclose the Karma threshold. This is to limit potential trolls and bad actors on the subreddit. If you use a throwaway account and need help, [let the moderators know](https://www.reddit.com/message/compose?to=%2Fr%2FPhilippines&subject=Requesting%20Assistance%20low-Karma).   

Please consider participating in other [Filipino related subreddits](https://www.reddit.com/r/Philippines/s/1rdCniBOBw) to increase your Karma before contributing in r/Philippines. Thank you for understanding  
***

*I am a bot, and this action was performed automatically. Please [contact the moderators of this subreddit](/message/compose/?to=/r/Philippines) if you have any questions or concerns.*",AutoModerator,1,1743636040.0
ml4u8gx,Tbf russia is already sanctioned and tarrifed to the balls way before this.,VernaVeraFerta,8,1743646413.0
ml4v7gh,"yung problema, it hurts PH sellers.

the US has a big customer base. not sure if the PH can sell more to China, Japan and others.",Menter33,3,1743646776.0
ml5qa2y,The funny thing is a lot of those electronics are actually part of the US military's supply chains rather than consumer goods. That's why they're here at all rather than somewhere with better infra and cheaper electricity. Because they needed to be located in a solid ally.,Teantis,1,1743661169.0
ml5ra78,"Ramdam ko na nga, tataas ang bilihin nila pero ang mga MAGA ipipilit nilang normal lang dahil sa inflation eh 🤣🤣",BeginningImmediate42,1,1743661761.0
ml4fmb1,"Trump is a businessman alam nya ginagawa nya hindi yayaman yan kung di nya alam ang takbo economy. Kumbaga mindset ng mga ganyan high risk high reward, no risk no reward.",RichTreat8513,-4,1743641228.0
ml3pr97,"If the infrastructure could be fixed, red tape reduced, and foreign ownership is allowed then it’s possible that foreign corporations would enter the market. Honestly, that law precluding foreign ownership is solely there so that local corporations don’t have to compete with foreign ones because by and large they would not do well is my guess. The people would win though because they would get better services with the increased competition.",Temuj1n2323,13,1743632476.0
ml3wzo0,"How dare you say wala silang talent?!? Bigay todo na nga sa pagsayaw, kanta, at arte pag miting de avance. Tapos yung isa marunong pa maghati ng bala. Lol. /s",NoAttorney3946,13,1743634870.0
ml3qh1p,You aren’t insulting me any. Politicians usually are pretty corrupt/inept. Are you going to argue it’s not the same here in the Philippines? Maybe only a handful of countries on earth have good governance right now. Of course there are levels to this though.,Temuj1n2323,5,1743632709.0
ml4mdz0,I don’t really know what you are getting at. Vietnam also struggles mightily with power shortages as well. They were having nationwide blackouts just a few months ago. Having state owned infrastructure requires competent and benevolent leaders to act on behalf of the people. Call me and tell me when you have that in the Philippines. It’s better to go the competition route by a long shot. The oligarchs will hate it since they won’t be raking in as much money but I dare say the workers would probably get treated much better concerning pay and benefits.,Temuj1n2323,5,1743643618.0
ml3vpxy,The list of 60-40 is still extensive. It’s still most industries. Also a lot of corporations want to own the land they have their factory on as well. It means lower overhead.,Temuj1n2323,1,1743634446.0
ml3zd2c,Therea loophole there re land ownership which technically implies there is no full foreign ownership if they cant acquire land.,ginballs,0,1743635652.0
ml4rds0,Oh it’s insane in the US as well but on the back end the finished product is much better there than here. Contractors here will skimp on rebar and inspectors are paid off. I have been here long enough to know how things work. I used to wonder why a concrete road just abruptly stops before completion. I wonder no more about that. 😂,Temuj1n2323,2,1743645379.0
ml3xsmj,"Hi u/Physical_Football854, your [comment](https://www.reddit.com/r/Philippines/comments/1jq0708/17_tariffs_imposed_on_the_philippines_trump/ml3xskh/?context=3) was removed due to the following:  
    - Your account did not meet the minimum karma requirements and wont be able to post and comment. We will not disclose the Karma threshold. This is to limit potential trolls and bad actors on the subreddit. If you use a throwaway account and need help, [let the moderators know](https://www.reddit.com/message/compose?to=%2Fr%2FPhilippines&subject=Requesting%20Assistance%20low-Karma).   

Please consider participating in other [Filipino related subreddits](https://www.reddit.com/r/Philippines/s/1rdCniBOBw) to increase your Karma before contributing in r/Philippines. Thank you for understanding  
***

*I am a bot, and this action was performed automatically. Please [contact the moderators of this subreddit](/message/compose/?to=/r/Philippines) if you have any questions or concerns.*",AutoModerator,1,1743635137.0
ml3jkaq,"I only feel bad for the Dem voting Fil-Ams. For the MAGA pinoys, they're now in the middle of their FAFO stage. Peak will be when their green cards start being revoked and they get thrown in Nicaragua without due process.",baybum7,53,1743630509.0
ml3jo7n,[deleted],Deleted,9,1743630542.0
ml3jd1t,"Yep, this is one way of taxing the US citizens without increasing taxes on US billionaires.

I hope it was worth it my fellow kababayans who hated illegal immigrants so bad and who hated taxes so bad because napupunta daw sa social services ng mga illegal immigrants.",EmotionalLecture116,9,1743630449.0
ml4b4y3,"I am a Fil-Am, and our family just feel terrible with all these daily gaslighting and divisive rhetoric.",gracefull22,0,1743639654.0
ml606gk,No reason to do this. Best move is follow what other ASEAN countries will do and work as a team.,quickkquickk,1,1743667311.0
ml4td6e,Its not a question mark since it happened before. Smoot and Hawley also promised manufacturing with their tariffs but ended in Great Depression.,Glass_Carpet_5537,3,1743646090.0
ml40vd0,"Hi u/Additional-Peace3258, your [comment](https://www.reddit.com/r/Philippines/comments/1jq0708/17_tariffs_imposed_on_the_philippines_trump/ml40uzz/?context=3) was removed due to the following:  
    - Your account did not meet the minimum karma requirements and wont be able to post and comment. We will not disclose the Karma threshold. This is to limit potential trolls and bad actors on the subreddit. If you use a throwaway account and need help, [let the moderators know](https://www.reddit.com/message/compose?to=%2Fr%2FPhilippines&subject=Requesting%20Assistance%20low-Karma).   

Please consider participating in other [Filipino related subreddits](https://www.reddit.com/r/Philippines/s/1rdCniBOBw) to increase your Karma before contributing in r/Philippines. Thank you for understanding  
***

*I am a bot, and this action was performed automatically. Please [contact the moderators of this subreddit](/message/compose/?to=/r/Philippines) if you have any questions or concerns.*",AutoModerator,1,1743636155.0
ml4p5mx,"Yeah, that's BS. It's as factual as Trump drawing a sharpie for the Hurricane track because he feels the Hurricane should go somewhere else.

Some people in Twitter also got the same numbers when they tried to compute for their trade deficit for their own country, based on what the claimed tariff was on Trump's table.

https://preview.redd.it/2aio8o5cyise1.png?width=1200&format=png&auto=webp&s=85955d83032796b7587f21f638b029416ed22dbe",baybum7,2,1743644595.0
ml4oe85,"Technically, a lot of countries are open to selling us military hardware, it's the government since FVR's time that has not been infusing enough money to the AFP to actually afford and buy the hardware. That's why the Revised AFP Modernization Law passed by PNoy was such an important milestone for the AFP, because it imposes and required minimum for his and the following administrations to put in money specifically for the modernization of the AFP.

But even with that, we've still been gravely underfunding the AFP modernization. We've only been spending 1% of our GDP, when it's been generally accepted to have a minimum spend of 2% to have a capable defensive armed force.",baybum7,4,1743644328.0
ml4i9js,"Example lang yun. Tantanan mo ko ng ""so you're saying"". Typical opener yan ng mga naghahanap ng strawman. I believe you're smart enough to do your own research. Have a good day.",hldsnfrgr,7,1743642156.0
ml3ql83,"Hi u/Spare_Astronaut2156, your [comment](https://www.reddit.com/r/Philippines/comments/1jq0708/17_tariffs_imposed_on_the_philippines_trump/ml3ql62/?context=3) was removed due to the following:  
    - Your account did not meet the minimum karma requirements and wont be able to post and comment. We will not disclose the Karma threshold. This is to limit potential trolls and bad actors on the subreddit. If you use a throwaway account and need help, [let the moderators know](https://www.reddit.com/message/compose?to=%2Fr%2FPhilippines&subject=Requesting%20Assistance%20low-Karma).   

Please consider participating in other [Filipino related subreddits](https://www.reddit.com/r/Philippines/s/1rdCniBOBw) to increase your Karma before contributing in r/Philippines. Thank you for understanding  
***

*I am a bot, and this action was performed automatically. Please [contact the moderators of this subreddit](/message/compose/?to=/r/Philippines) if you have any questions or concerns.*",AutoModerator,1,1743632747.0
ml445aa,"Why the fuck would I listen to the fucker who’s actively threatening the rights of immigrants? Why should I listen to this asshole who’s known to bankrupt his own and other partners’ ventures? This reeks of “just trust him, bro.” Wala kang pinagiba sa mga DDS",DisintegrationDream,7,1743637251.0
ml4mxe5,"I just saw some additional info and the numbers Trump showed there are trade deficits, not tariffs. So the 34% is the trade deficit between PH and US, not existing tariffs of PH for imported US goods.

And usually, tariffs are negotiated between countries, not like what Trump is doing now where it's unilaterally changed, because it encourages hostile actions between countries like what's happening now.

And the US can just produce on their own, but they won't, because it's cheaper to import. Trump and the GOP can cry all they want, but that fact cannot be undone by just imposing random tariffs against other countries. The US is a post-industrial developed nation, and other countries will just have lower wages and lower production costs, no matter how much they b\*tch and moan about it.

If they don't want it, and they feel that buying imports is at the ""expense of Americans"", then have them tell their citizens to stop importing. It would be interesting to see how soon that causes a downfall. Much faster than this scorched earth tariff.",baybum7,-2,1743643810.0
ml4y6j8,"And how did he justify ""reciprocal"" to arrive at the numbers he's imposing as tariffs?",baybum7,3,1743647909.0
ml5s5yj,"exactly, alam nila na ang next war ay cyber warfare, wala ng war na mangyayare na dahas ang gagamitin, it's all about internet propaganda na",Dazzling-Light-2414,1,1743662293.0
ml5ruwd,Tangina talaga 🤣🤣🤣,BeginningImmediate42,1,1743662108.0
ml5vng0,Never in my life na akala ko di ako makakaexperience na maubusan ng itlog. $7 for a 10-pc egg? Grabe. Kaya di na ako nagcoconvert e.,july99,1,1743664416.0
ml812ao,"Same. lalo sa mga tinawanan ang UK kasi malaki sahod sa US, nagyabang pa burned bridges kumbaga. yeah okay america is great again nga. goodluck with the eggs",lavenderlovey88,1,1743697053.0
ml5fbfn,Yes and no to bird flu ang isang cause kaso tong si Trump inuna pa patawan ng tariff ang Canada and Mexico kaysa ayusin ang relationship now rejected sila sa ibang country they are trying to eggs somewhere pero mas uunahin nila ang proganda kaysa ayusin ang supply nyan.,sentient_soulz,8,1743655265.0
ml49p3w,"Im gonna defend our country to the death, pero pag may dds na winiwelcome p ang china sa panahon ng gyera, uunahin ko sila barilin sa mukha.",pinoyHardcore,90,1743639145.0
ml53rkr,[ Removed by Reddit ],Pragmatic787,0,1743650128.0
ml4logt,Drones was the next big thing sa war we should get one as well para bago pa makasampa satin ang mga Chinese na yan na bomba na sila.,sentient_soulz,1,1743643367.0
ml3prgm,"Hi u/Spare_Astronaut2156, your [comment](https://www.reddit.com/r/Philippines/comments/1jq0708/17_tariffs_imposed_on_the_philippines_trump/ml3prf2/?context=3) was removed due to the following:  
    - Your account did not meet the minimum karma requirements and wont be able to post and comment. We will not disclose the Karma threshold. This is to limit potential trolls and bad actors on the subreddit. If you use a throwaway account and need help, [let the moderators know](https://www.reddit.com/message/compose?to=%2Fr%2FPhilippines&subject=Requesting%20Assistance%20low-Karma).   

Please consider participating in other [Filipino related subreddits](https://www.reddit.com/r/Philippines/s/1rdCniBOBw) to increase your Karma before contributing in r/Philippines. Thank you for understanding  
***

*I am a bot, and this action was performed automatically. Please [contact the moderators of this subreddit](/message/compose/?to=/r/Philippines) if you have any questions or concerns.*",AutoModerator,2,1743632478.0
ml43l63,parcel niya from China naman ata kasi ang tinutukoy niya,Rvye,12,1743637063.0
ml5obia,"So eto na nga, hahaha sa pagkakaintindi ko nagreready na sila nung mga nakaraang buwan pa para sa tariffs na yan. I think may hihiramin silang pera para sa mga bonds sa bansa, hoping na maging mataas daw ang interest rates at balik. We'll see.

Correct me if I'm wrong, I'm all for learning as I'm still trying to figure this thing out and as I am new in investing din at tumaya ako sa US market (konti lang naman).",BeginningImmediate42,1,1743660026.0
ml45ym0,vice,SeaworthinessNo9347,9,1743637858.0
ml5cspo,Dami kasi di aral at mahirap sa pinas :(,New_Mycologist_617,1,1743654052.0
ml5sdgp,"Probably a good time for Americans to learn how to make water pie na, jk

Plano ko pa nga din sana maglagay ng pera sa US stocks, buti di ko pa nalalagay.. although plano ko naman sana sa REITS nila",BeginningImmediate42,1,1743662418.0
ml4kdus,Got it!,Peony127,3,1743642906.0
ml59k2v,">The great depression

This sub, after BBM won?",Vordeo,8,1743652577.0
ml4w4sx,"It's especially damning as we've always been pushing for an FTA with the Americans since forever to compete against the likes of Vietnam in the American market, but the US government itself showed no interest in actually doing so. 

I'm curious what we'll do and what we can do about it however. As I understand, we're looking to ramp up agricultural exports from the US, beef and poultry and whatnot that comes from red states.",supermarine_spitfir3,12,1743647126.0
ml52jkf,Agricultural products like pork are the only few items were tariffed more than 30% sa Pinas before https://usmef.org/audio-report/philippines-extends-lower-pork-tariff-rates-through-2024. That's understandable since we produce pork and chicken locally.,thejamesarnold,2,1743649639.0
ml4td7s,"What unfair? The US doesn’t pay the 34%, Filipinos do. Its to protect our own industries from getting obliterated by foreign goods and then we became too dependent on such foreign goods.

Frankly, I don’t agree with ‘protecting our own’. These Pinoy businessmen doesn’t really innovate, they pay workers peanuts, fight wage increases and all that to come up with shit quality because Pinoys can’t afford the alternative just so they can enjoy the high life of ultra luxury with their politician friends. Some businesses doesn’t deserve protection at all.",reggiewafu,11,1743646091.0
ml4cl2i,Thats why the U.S have trade deficit against the world specially on E.U.,re-written,5,1743640162.0
ml4jovq,"ang kapalit naman is US having military bases here in the Philippines which is strategic to scaring China forever. it was a win-win situation for us, ewan na lang ngayon",taxms,7,1743642663.0
ml52wfl,"We do not charge 34% on all US products, in fact, only pork and few agricultural products have tariffs more tan 30% (but lower now) https://usmef.org/audio-report/philippines-extends-lower-pork-tariff-rates-through-2024. Trump and his minions only show the largest number they can find and show it to his uneducated followers. The average tariff to US products is way way lower than this, maybe 1 digit.",thejamesarnold,2,1743649780.0
ml4mxug,No. It’s quite unfair for us.,NaluknengBalong_0918,1,1743643814.0
ml3owph,"In that case, time will tell if our products will be more expensive vs US made. Ofcourse, consumers will lean more towards cheaper products and will affect our country's export revenue. Unless the gov't can find another trading partner to replace US.",No-Homework273,22,1743632198.0
ml4h5wi,"People have noticed that for a number of countries, the supposed tariff rate they’re claiming isn’t accurate, and it so happens to correlate to their US trade deficit/total trade numbers. 

For the numbers you cited, 4.9b deficit/14.2b trade = 34.5%

It isn’t a reciprocal tariff, it’s a new tariff based on the US trade deficit.",passwd123456,1,1743641767.0
ml3ryhs,60 or so countries.,eBalita,6,1743633195.0
ml5qndf,"Parang ang bait bait nung ""discounted tariff"" hahaha parang presyong kaibigan pa ang gustong palabasin eh

Pansin ko yung data ng tariff from other countries, including currency manipulation and trade barriers, ganun din ba yung included sa ""reciprocal tariff"" nila? Half yung nirereciprocate nila except kung 10% siya, 10% lang din ang reciprocal tariff.",BeginningImmediate42,1,1743661384.0
ml56bv7,"Yes. I see this is as a more PRO for us.  
I hope PH can grab this chance given that we can be seen as a tariff safer location w/ cheap labour.",arcinarci,4,1743651183.0
ml5s3un,"Yes, but what I mean is, for example sa grocery sa US, sa bigas kunwari, may made from vietnam, philippines and thailand, sa atin ang magiging cheaper option, tama ba? Kasi lahat nagmahal pero sa atin yung di ganun kamahal kasi mas mababa tariff ng atin? Whereas mapipilitan yung Vietnam and Thailand na mas malaki ang increase ng bigas nila dahil malaki din ang inicrease ng tariff nila?",BeginningImmediate42,1,1743662259.0
ml75ypg,Vietnam forgot to say gg damn,Hydrazolic,1,1743687672.0
ml4l8kb,"Last punta ko sa asian store wala pa (colorado),if bumalik man mas mahal na for sure.",esr0159,3,1743643211.0
ml4fbpr,"Hi u/Denzshow, your [comment](https://www.reddit.com/r/Philippines/comments/1jq0708/17_tariffs_imposed_on_the_philippines_trump/ml4fbnt/?context=3) was removed due to the following:  
    - Your account did not meet the minimum karma requirements and wont be able to post and comment. We will not disclose the Karma threshold. This is to limit potential trolls and bad actors on the subreddit. If you use a throwaway account and need help, [let the moderators know](https://www.reddit.com/message/compose?to=%2Fr%2FPhilippines&subject=Requesting%20Assistance%20low-Karma).   

Please consider participating in other [Filipino related subreddits](https://www.reddit.com/r/Philippines/s/1rdCniBOBw) to increase your Karma before contributing in r/Philippines. Thank you for understanding  
***

*I am a bot, and this action was performed automatically. Please [contact the moderators of this subreddit](/message/compose/?to=/r/Philippines) if you have any questions or concerns.*",AutoModerator,1,1743641125.0
