Comment ID,Comment Body,Author,Upvotes,Timestamp
ml3jwsy,Magaling talaga to. Magaling magahanap ng kaaway ayan talaga purpose nyan ni Trump magsolo ang America 😆.,sentient_soulz,655,1743630614.0
ml3ljj6,This is meant to tank the U.S. economy so his corporate cronies can swoop in and buy everything up pennies on the dollar.  Trump and the GOP congress who have ceded their power to him are not acting like they're concerned about any future elections.  That should tell you something.,ultrasuperhypersonic,513,1743631119.0
ml3hw7m,Lets see how marcos reacts,breezy_peezy,102,1743629994.0
ml3s31u,Good luck sa mga Fil-Am (non-trump supporters) kababayans.,ShallowShifter,95,1743633239.0
ml3o1ey,"I'm surprised it took this long

I guess he was finally looking at the checklist of countries to harass for no actual reason",nyemini,171,1743631919.0
ml3xwk1,I really don't know what he hopes to achieve with this. Factories start opening up again in the US? Reciprocal tariffs? Concessions from other countries?,Independent-Cup-7112,38,1743635173.0
ml3v5jk,"Trump thinking he's a master economist, haha. Grabe let's see what he gonna do once he and his cronies are kings of a ruined land.",Queldaralion,80,1743634259.0
ml47z3k,"Tarrifs won't increase their job availability.

Wait, didn't all of this happened before? Right, The Great Depression of the 1920-1930s. US imposed tariffs on everyone and a global trade war happened. That shit is the reason why Hitler rose to power. No one can feed themselves so he easily convinced everyone that the world is the enemy.

History is repeating itself boys. Prepare your financials.",bad3ip420,50,1743638545.0
ml4al3l,"https://preview.redd.it/a9icivw9jise1.jpeg?width=640&format=pjpg&auto=webp&s=27c871eade41ac90a700fcec48d8edea01d67f43

From a newspaper in Red Dead Redemption 2",ScarletSilver,64,1743639462.0
ml4a1jl,"This could easily cause a massive decline in the United States. 

Imagine if the rest of the world just decides to sign free trade agreements with one another - why bother trading with the US any more?

Going to isolate his own nation's economy.",mezuki92,17,1743639268.0
ml40tit,"Magiging surprising ang midterm elections nila next year. 

Just like 2006 lol.",NoH0es922,12,1743636138.0
ml3q5xc,"Different perspective lang. Can we take advantage kaya on the fact that we’re still one of the lowest % of tarrif? I only have the very basic understanding of economics and finance, pero most likely maghahanap ng malilipatan yung ibang manufacturers and offshore services (like BPOs). How do we use this situation in our favor kaya?",Accomplished_Ad_1425,35,1743632610.0
ml3j4qd,What products are most affected by this?,trigo629,11,1743630377.0
ml422zd,Prices at Seafood City are going to go through the roof.,PandaBJJ,12,1743636558.0
ml4dlo3,Seeing that there is no Russia in that list.... Quite telling Agent Krasnov 😂,-_--Cytolei--_-,23,1743640519.0
ml3kczr,ang laki sa vietnam at china. god bless america lol,ashlex1111101,32,1743630751.0
ml3rssh,HAHAHAHHAHAHA WHAT A CLUSTERFUCK,fiftytwoblackguard,14,1743633143.0
ml4kay5,Mga Americans Ang mag SA suffer because of high prices.,MFFL12_17,7,1743642878.0
ml3vuat,Ano ba ini-export natin to america?,Prior_Photograph3769,7,1743634487.0
ml40znz,MAGAs are as fucking stupid as DDS,YukYukas,34,1743636195.0
ml4cn23,Decades of investment para maging dependent ang mundo sa US nawala in just a few months. Parang mga DDS lang ang MAGA.,LonelySpyder,10,1743640181.0
ml3w32d,What is the purpose of this? Ang daming changes na ginagawa ni trump na parang paurong na Yung US. Pati diversity programs reversed na rin.,suffer_hero,9,1743634568.0
ml4ouj6,"What’s crazy is how they determined the calculation. If you run down all the non 10% countries, every single one including the Philippines someone just divided the trade deficit by the amount imported into the United States to determine the “Tariffs charged to us”. Then they divided that number by 2 to determine “reciprocal tariffs. For the Philippines… $4.9bn deficit/$14.2bn exports to US= 0.3451 (rounded to 34%). Divide by 2 for your 17%. 

They did this to Israel too who just last month lowered tariffs on U.S. imports to zero 😂. What a 🤡",Pitiful-Recover-3747,8,1743644487.0
ml3m3qz,What if the Philippines lower the US tariff further and the US will do the same. This way businesses from China and Vietnam will go to the Philippines instead. Especially textiles.,Horny_Ijot,18,1743631298.0
ml3rfrg,He wants a bailout. The ultimate goal.,kankarology,3,1743633026.0
ml46s8b,Well lets not buy the F16 and just go Gripen. Brand new pa kesa 2nd Hand na gusto nila inenta sa atin,shalelord,4,1743638135.0
ml41uro,"Good luck to our brothers and sisters in US, especially the maga ones-- binoto nyo yan eh. Get ready to face the consequences!",xchyssa,13,1743636482.0
ml41suc,"If I got it right, it’s actually a decrease from 34% to 17%. Isn’t that a good thing when we export to The United States? 🤔",Better-Service-6008,7,1743636464.0
ml3ht16,"17% tariff, so SnR and other US product prices dito will rise if ever?",EmperorUrielio,8,1743629966.0
ml3ytdw,*OT* but this just reminds me of when P.Diggy revealed his Drug Matrix. Kumpleto pa with placards. lol,rxxxxxxxrxxxxxx,3,1743635474.0
ml50m6v,"Now I see why China, Japan, and South Korea suddenly decided to play nice with each other. If he maintains this track record, South East Asia is gonna follow suit.",SGTPEPPER_27,3,1743648864.0
ml41p2v,"https://www.aljazeera.com/news/2025/4/2/a-historic-moment-donald-trump-unveils-sweeping-reciprocal-tariffs

""Historic moment"" my ass. Some get more massive tariffs than normal. Of course this is going to wreck international trade completely, we'll be only exporting elsewhere, as that kind of economic ultranationalism aka autarky that bastard wants to promote may backfire.",angrydessert,3,1743636429.0
ml3uub3,I guess we aren't special....,shortstopandgo,2,1743634157.0
ml4akkn,"Why was he chosen as the Republican presidential candidate, I wonder? There are a lot of decent Republicans out there—or is there more to it than that?",Personal_Wrangler130,2,1743639457.0
ml4g12h,Ayan maga pa,nanamipataysashibuya,2,1743641369.0
ml5qmco,"still can’t believe of all the filipinos who voted for this orange turd! nakakahiya! akala mo mayayaman at kasama sila sa mga taong magkakatax benefit! akala mo porket citizen na sila at may napangasawang kano ang baba na ng tingin sa mga illegals who are by the way still paying taxes and they will never even get any federal public benefits because you have to have papers to be eligible. 
hiyang hiya talaga ako everytime na may nakikilala ako tapos binoto pala nila ay si trump! ughhhh",xxtiramisu,1,1743661368.0
ml3p8fc,We call this autarky. The turning inward of a country. This never does well. That’s why in the 70s US experienced a recession.,two_b_or_not2b,2,1743632304.0
ml48b4k,Putang ina talaga. Mas lalong di ko na maaafford kumain ng filipino food,trivialmistake,3,1743638660.0
ml3royd,"wala silang kinatatakutan kasi 
kayang kAya nila, pilipinas at singapore lang may pinaka mababang tariffs sa SEA, dapat din galingan ng ibang bansa para kaya din tumayo sa sariling paa, wag kasi puso asa sa china, yan ang logic ni trump.",koolins-206,5,1743633109.0
ml3hi7u,"FUCK DRUMP THE RUMP AND HIS RUZZIPUBLIC CRONIES! 

Mofo kept saying he'll ""focus against China"" while still allowing TikTok and having the MAGA hats his supporters/cultists wear be made in China. 💀",John_Mark_Corpuz_2,4,1743629874.0
ml3wr6l,Hindi alam ng unggoy na ito what made America great in the first place lol!,Sea-Butterscotch1174,2,1743634792.0
ml42jsy,"Vietnam charges 90% on US goods?? Cambodia at 97%, South Korea at 50%? Pero bakit ang mahal pa din satin bumili compared sa mga bansang ito??",setsunasensei,2,1743636715.0
ml56tdd,"WE ARE NOT AN EXPORT ORIENTED ECONOMY!

Dami maka react na mga ungoy kala mo naman magugunaw Pilipinas sa 17%  
hahaha",arcinarci,1,1743651389.0
ml3uai9,[removed],Deleted,1,1743633975.0
ml3za84,Vietnam has the highest tariffs because a lot of US companies outsourced their manufacturing to them usually moving from China.,Sparky_Russell,1,1743635627.0
ml4358o,ELI5?,wharangbuh,1,1743636916.0
ml47x5k,i would be alarmed ... if I was paying for those.,Free_Gascogne,1,1743638526.0
ml4c7xn,[removed],Deleted,1,1743640034.0
ml4ccxn,Source nito?,CryMother,1,1743640082.0
ml4cjt8,"well, expected naman because lahat nalang tinitira niya",casademio,1,1743640149.0
ml4da4p,AMERICA- Tariff capital of the world,KeyBoysenberry8888,1,1743640405.0
ml4fvti,inflationary ung tariffs. its been beaten to death how magats see the tariffs as opportunity to force production back to america.,YeezusKristo,1,1743641318.0
ml4ghwa,[removed],Deleted,1,1743641531.0
ml4gjdi,[removed],Deleted,1,1743641546.0
ml4guxr,"Negosyante talaga eh,",domondon1,1,1743641659.0
ml4jebv,"I mean we also charged them 34% tarrifs. Kaya nga ang tawag e ""reciprocal"" tarrifs. We would be fine.",dontrescueme,1,1743642559.0
ml4jvjc,"I guess it is a businessman kind of thinking. If you direly need cash to save your shop then you squeeze every source that you have right now.

If you look years back, it is so hard to get military hardware from them. When China became aggressive in the late 2000's what did US gave us to boost our patrols? A second hand hand me down frigate/cruiser??? While Afghanistan got all the nice pieces of hardware bells and whistles and now they are in the hands of the Taliban.

Surprisingly, they are now allowing us to buy F-16s.",FutabaPropo1945,1,1743642728.0
ml4k9ti,Reciprocity should be the game on all foreign affairs front. Sana higpitan na rin visa ng mga foreigner rito.,One_Presentation5306,1,1743642867.0
ml4m5up,Mass deportation ongoing plus etong tariffs. Good luck talaga 🥴,Thecuriousduck90,1,1743643537.0
ml4mjx3,"Uhh, okay. Whatever you want orange buddy. We don't really need your stuff or need you to need our stuff.",annoventura,1,1743643677.0
ml4mt86,"So, my company operates in the Philippines. What happens when we import our goods from there stateside? Are we faced with tariffs on our own goods?",MrMeowPantz,1,1743643768.0
ml4ovid,"Pinoy MAGA, what now? Samba pa din kay Trump?",Candid-Bake2993,1,1743644497.0
ml4pjt8,Ung 34% literal na dinivide ung trade imbalance ng US at Pilipinas tapos divided by 2. Meron na nagcompute nyan sa X.,Much-Access-7280,1,1743644732.0
ml4popf,"This turd is really fuxking crazy. We've had our own degenerate leaders but in the end it only really affects us. This orange man is really gonna mess up the whole world. 

And here I thought America will have their first ever people power.",rangerdemise,1,1743644779.0
ml4pywz,"Who will absorb and pay this tariff? It's the American consumers..it will have inflationary effects on them. They should impose that reciprocated tariffs, only on the same products they also produce / manufacture in the U.S. Otherwise, the Americans are on the losing end.",primero1970,1,1743644877.0
ml4qldb,Half of Filipinos are still busy asking Trump for help for tatay digong and are getting bitch slapped with tariffs instead 🙂‍↕️,Icy_Concentrate2774,1,1743645098.0
ml4qxin,I smell opportunity. Philippines galaw-galaw eto na oh.,patatatatass,1,1743645217.0
ml4r5xo,America is in villain arc,Rouletteer,1,1743645301.0
ml4sss2,This is what we get after virtually acting as bait for Uncle Sam since goodness knows when? Wow.,VernaVeraFerta,1,1743645884.0
ml4torb,"Compared to other countries

We kinda got off lightly",Downtown_Grape3871,1,1743646209.0
ml4u0zd,"Matching Philippines tarits on USA , ....",aharwelclick,1,1743646336.0
ml4uq79,"To those wondering, the tariff amount charged is equal to the percentage of trade deficit relative to the total US imports (and then divided by 2 with a 10% minimum with the respective country. Why? idk, sounds a little brain-dead to me, for such a complex issue. I guess it’s Trump arithmetic

Quick math using the numbers published by the US

Office of Trade (USTR) does seem to add up:

China: $295.4B/$438.9B = 67.3% -> 34%

Vietnam: $123.5B/$136.6B = 90.4% -> 46%

Singapore: -$2.8B/$43.2B < 0 -> 10%

Philippines: $4.9/$14.2B = 34.5.% -> 17%",Civil-Ad2985,1,1743646597.0
ml4utpd,"Oh no, Vietnam is cooked😂. Close competition pa naman ang PH at Vietnam pagdating sa economic growth. Pag nagtuloy tuloy ang growth rate ng Vietnam, iwan talaga ang PH. Trump tarrif will disrupt Vietnam's growth, allowing the PH to take a lead.

May mabuti ding naidulot na hindi manufacturing export oriented ang economy natin unlike sa Vietnam at Thailand na super reliant sa pag export ng manufactured products. Kaya tuloy kapag may gulo sa international scene, ang unang tatamaan ay yung manufacturing sector.

So far, ang biggest strength ng PH economy are OFW's remittances and BPO sector, na puro nasa service sectors.  Mas diversified yung economy kaya kapag tinamaan yung isang sector like manufacturing, merong ibang sector na pwede mag step up para mag balanse.

Naalala ko nung 1st term ni Trump, sya din may pakana nung trade war vs China. Ang ending, Vietnam ang pinaka nakinabang dahil yung mga businesses or manufacturers sa mainland China, ipapadala nila sa Vietnam yung mga finished product para lang tapalan ng ""Made in Vietnam"" label para makaligtas sa taripa. Yun ang dahilan bakit sobrang umangat yung Vietnam, to the point na naungusan nila tayo in just half a decade/ 5 years!. Sana magawan din ng aksyon yang ganyang modus sa Vietnam.",Specialist_Elk6882,1,1743646634.0
ml4vihr,"My client from financial space, he is not investing sa mga stocks or investments from S&P 500 specially US companies. He knows pabagsak na ang economy ng US, he is inclined to invest more on China. Mind you 30 yrs ang experience nito in portfolio investment. Ganyan pa ginagawa nitong baliw na Trumptado na to. Goodluck MAGA!",horniesaint,1,1743646891.0
ml4wv19,[removed],Deleted,1,1743647402.0
ml4wyoy,[removed],Deleted,1,1743647441.0
ml4xagp,"To all the FilAms and AFAM beneficiaries who voted for this guy, remember that this is your choice and your fault why this orange turd is now in power. So enjoy the consequences of your actions!",ntmstr1993,1,1743647566.0
ml4xibx,Trump is the dumbest president in history of the United States,Traditional_Tax6469,1,1743647650.0
ml509dl,"Ito ang dapat pag tuunan nang atensyon ni bebeyem kesa sa polpoltika nya. The best he can do is negotiate with the US kung magaling sya na presidente.

Unluckily we cannot compete with the US lalo na sa agrikultura kasi highly advance ang farming at large scale pa amg farming nila. Sa atin majority ay makaluma pa din ang farming at small scale dahil sa agrarian reform. Very inefficient ang storage facilities natin pati na din ang distribution system natin. Kaya need ang tarrif to protect our local industries. 

We benefit a lot from our relationship with the US isa na dyan ang mga BPOs.",Apart_Sprinkles_2908,1,1743648720.0
ml509t3,Is America waking up yet?,Dull-Satisfaction969,1,1743648725.0
ml5150w,"The U.S. was following the opposite for decades because it wanted cheap goods and products from others while counting on them to continue using the dollar for trade. That, in turn, allowed the U.S. to borrow heavily to spend heavily, not only on consumers but even on the military. And that's the same military it used, together with onerous foreign policies, to keep others weak and thus dependent on the dollar for trade, and even on the U.S. for aid that came with strings attached.

https://www.youtube.com/watch?v=5BXtgq0Nhsc",tokwamann,1,1743649073.0
ml532d6,Bakit kaya medyo malaki yung atin compared sa ibang allied countries?,DurianTerrible834,1,1743649845.0
ml53dn3,"No, PH does not charge all US products with 34%. Every product has a different tariff. If we produce a certain X product here in the PH, imported X items will have a higher tariff. Example pork [https://usmef.org/audio-report/philippines-extends-lower-pork-tariff-rates-through-2024](https://usmef.org/audio-report/philippines-extends-lower-pork-tariff-rates-through-2024) which has the highest tariff we put because we produce our own pork here in PH. Most products from the US have way way less tariff and the average might be 1 digit percent.",thejamesarnold,1,1743649972.0
ml53fl4,"Maiba lang ako, pero congrats sa Taiwan for being a country in the eyes of the Trump administration.",ravstheworlddotcom,1,1743649994.0
ml559ft,"17% wont affect as ut all. We are at 9% before, not a big jump compare to others.  
  
We are also not an export oriented economy. Our main exports to US are services.  
You can't put tariff on those, so we are pretty safe.

In fact its actually a good thing for us.  
High chances are those companies from Viet, Thailand  will go to relatively Tariff safer countries like their baby puppy the Philippines.

Ang kawawa ang Vietnam. Durog na durog talaga. Majority ng economiya nila is through exports.",arcinarci,1,1743650739.0
ml55ab2,"The problem with people like Trump is he is surrounded by Yes-men, but I get it, he's a bully and it must be terrifying to cross the old fool",Sufficient_Fee4950,1,1743650749.0
ml56afr,Nasan na kaya ung mga kakampink na trump supporters dito? :D,DowntownNewt494,1,1743651167.0
ml582df,"Why is America antagonizing their traditional allies like Canada and European countries like Denmark, Germany, NATO countries?",preciousmetal99,1,1743651923.0
ml58got,"Trump is a Russian asset, he is destroying the US economy for Putin.",CharlieDStoic,1,1743652095.0
ml58pgf,"Tampukinang nyo mga tita at tito kong bumoto ng republican netong huling election. 

Pucha. Pagsisihan nyo yan.",harry_nola,1,1743652203.0
ml5939f,It's the great era of lunatic leaders.,ultra-kill,1,1743652371.0
ml59r00,Please impeach this guy I aint tryna serve for this guy,retardinreditrecon,1,1743652662.0
ml59vo4,[removed],Deleted,1,1743652720.0
ml5br99,Lots of Fil-Ams voted for him,thecragmire,1,1743653566.0
ml5d7k8,"with an ally like this, who needs enemies?",Latter_Rip_1219,1,1743654246.0
ml5fny3,This shows what kind of a “genius” he is./s,paullim0314,1,1743655433.0
ml5fo62,"Cancel na Balikatan, close the embassy, cut ties.",kinofil,1,1743655435.0
ml5frvz,"This is not good for those americans. The cost of living will skyrocketed on their country. 

Lahat na ng products coming from outside america pinatungan ng tariff - friendly or unfriendly countries.

Bka mag welga mga tao nyan soon. At malamang mag aalisan din.",SheepherderChoice637,1,1743655485.0
ml5iv2g,America is tanking for Cooper Flagg.,TheSixthPistol,1,1743657064.0
ml5j94l,"The Philippines should adjust the personal exemption in customs duties from 10k to at least 50k. It has been stuck at 10k for so long, the exchange rate outgrew it. You can barely buy anything without getting taxed and now this happens.

If the BIR hikes personal tariffs without adjusting the ever-so-stuck 10k exemption, then the exemption will be more worthless than it already is.

Lots of products in this market are either overpriced or fake or both, example supplements or tech. It's impossible to purely buy local when the products just aren't there. It'll be devastating if consumers are left with little to no choice.",nyetsub,1,1743657269.0
ml5k5fn,Importers naman ang nagbabayad ng tariffs hindi ang exporters.,BikoCorleone,1,1743657741.0
ml5k837,"Imagine this scenario...

US Alienates itself from all its allies, emboldening China to be more aggressive in their Oceangrabbing. Because of this, all countries south and around China form an alliance to help each other prevent China from claiming territory. Which then prompts Japan to re-militarize. Yadda yadda, Japan eventually goes to the coast of Florida/New York with gunboats demanding US to open back up and trade or else. Not in Hawaii tho. That would be too on the nose.

Yep. All that setup for an ironic punchline. But IMAGINE doe.

But seriously... Dapat siguro binuo ko na ung update ng gaming rig ko nung January pa lang gawa nito. At this point baka di na muna ko mag upgrade.",vulcanfury12,1,1743657780.0
ml5kex9,"Ang naiisip ko lang, pag bumagsak ang US, madadali din kaya tayo? Since the PH does lot of back end work for American companies and a lot of remittances come from the US.",Conscious_Curve_5596,1,1743657878.0
ml5ky2i,"Ok na mas mataas tarriff sa competition natin sa main export natin sa US, which is ICs.  Possible na mas pipiliin tyo over china etc since mas maliit tarriffs sa atin.",zandromenudo,1,1743658164.0
ml5o8ln,Yippee 💀,Allen-R,1,1743659981.0
ml5odse,Trump is uniting the world - uniting countries against the US.,capmapdap,1,1743660063.0
ml5ol7y,[removed],Deleted,1,1743660182.0
ml5pau8,I am thinking why 17% tariff? UAE and Singapore got 10% only.,SheepherderChoice637,1,1743660596.0
ml5r3yt,Guys.... Yung mga kilala ko pinoy conservative masaya dyan sa tariff. Kasi babalik daw jobs sa america. Hahahahha halatang di naiintindihan yung epekto ng tariff sa kanila .,Masterofsnacking,1,1743661658.0
ml5te5g,[removed],Deleted,1,1743663033.0
ml5tnb3,"For the groceries, replace american products with products from allies.

Don't buy spam. Buy tulip (denmark). It's same taste, better ingredients and is cheaper",ZYCQ,1,1743663186.0
ml5txlg,"Bring Fil-Am home, welcome sila dito tutal Golden age na nung idol nila.",Matcha_Danjo,1,1743663359.0
ml5up30,"Nah kahit mag-tariffs pa yan, people will still buy overpriced iPhones lalo na yung 16e lol",sumiregalaxxy,1,1743663827.0
ml60vxz,[removed],Deleted,1,1743667766.0
ml62396,[removed],Deleted,1,1743668552.0
ml6581w,[removed],Deleted,1,1743670598.0
ml671nq,"And who's paying more taxes?

The American taxpayers and registered voters. 

They're the ones who are going to suffer as much as we are.",Background-Elk-6236,1,1743671779.0
ml6cnq0,"Analysts expect the impact on the Philippines to be mild, with electronics exports largely unaffected due to low tariffs and ITA coverage (https://www.bworldonline.com/economy/2025/04/01/663283/impact-of-trump-tariffs-on-phl-expected-to-be-mild/). However, agricultural exports to the U.S., though smaller, may face challenges, with secondary effects on GDP growth moderated by domestic demand policies. The Philippines’ trade policy, part of ASEAN and RCEP, focuses on eliminating tariffs with partners, not directly addressing U.S. reciprocal tariffs, suggesting limited retaliation capacity.",Secure_Sir_2574,1,1743675231.0
ml6e13p,bcos of this i just learned that we actually import integrated circuits from America. Which is weird when we Export the same thing. Im no finance person/manufacturing pero i just found it funny that we exported $29 Billion worth of IC last 2023 and imported $13 Billion in the same year.,uniqueusernameyet,1,1743676003.0
ml6ff79,"Reciprocal? What do we export to the US? Coconut oil, canned tuna, plus Quiboloy's underage lovers?

I would have thought we imported more stuff from them - the American pedos for example - except I guess they make their stuff in China so it doesn't count as American.",Glittering_Boottie,1,1743676757.0
ml6k9im,Nag hahanap cguro ng away kasi walang takwents ung binebenta nilang armas,Less_Ad_4871,1,1743679159.0
ml6l6cr,"PH should make a move. Galaw2x naman. Mas mababa tariff ng PH vs Vietmam, Cambodia na dun na mga factory ng mga US brands. PH should take advantage. It can create jobs pag umalis sila sa ibang SEA countries and lumipat sa PH.",southerrnngal,1,1743679585.0
ml6lae0,Bigla ko tuloy naaalala yung mga nagcomment na against sa Trump winning post being posted dito sa r/ph. O ayan ang isa sa proof kung bakit inallow ang post about Trump.,Aeriveluv,1,1743679637.0
ml6tgbh,"Imagine the price ng something manufactured with US wages + tariffs on raw materials na kakailanganin, ah a sustainable plan 😂",Dependent_Loss212,1,1743683130.0
ml6tsoa,Trump's arrogance and US congress complicity harms US citizens more than the countries hit with tariffs.,stoikoviro,1,1743683270.0
ml6xdek,"He also imposed tariffs on Heard and McDonald Islands. uninhabited islands that's only populated by penguins and seals. 

He's basically waging a tariff war against penguins, lol",jamesFX3,1,1743684642.0
ml7kwbd,Too bad MAGAts still think what he is doing is brilliant and will certainly help americans. The supporters are just the same as DDS. They believe everything Trump says and he can never be wrong. Even if it means they're turning away from the morals(if they have any to begin with).,Smart-Diver2282,1,1743692281.0
ml7v85u,[removed],Deleted,1,1743695319.0
ml85uhm,America is not a dreamland anymore not like back in the 70s 80s 90s.,aprefoiss,1,1743698470.0
ml874u4,"""WARNING: If you're Gambling your money away, most likely your brain is hacked by a.i.""",sonostreet,1,1743698851.0
ml9xflq,"EU, Middle East and China could connive to replace dollar as the world’s reserve currency.",PapaP1911,1,1743717459.0
mlai2wt,negosyante kaya profit first. kaso bobo sa accounting,saltedgig,1,1743724674.0
mlal04k,FDT,Jarhead-DevilDawg,1,1743725759.0
mlaqert,His last chance to ride the roller coaster before his final crash.,Present-Salad6100,1,1743727769.0
mlb19bx,Then let's do what the rest of the world is doing— boycott US products/brands,thenetnegative,1,1743731868.0
mlbhoyk,[removed],Deleted,1,1743738498.0
ml3zvol,"Wala naman yan epekto satin. Dapat sa mga local exporter hindi mag-adjust sa prices, tulad ng di pag-adjust ng importers sa local VAT to make it cheaper.",Agitated_Anteater189,1,1743635823.0
ml410vz,"Tataas ang presyo ng mga Apple products (Iphone, Ipad, Mac), pati laptops, mga computer parts lalo na Nvidia GPU. Good luck nalang talaga.",Better-Extreme4500,1,1743636206.0
